audio,text
5456-62043-0010.flac,WHAT'S THE ODD QUARTER FOR I SHOULD LIKE TO KNOW YOU ONLY CHARGED ME THREE AS I WENT DOWN WHY CAPTAING DRAWLED OUT THE WOOD MERCHANT WITH A SORT OF LEER ON HIS YELLOW COUNTENANCE WHICH CLEARLY INDICATED THAT HIS WOOD WAS AS GOOD AS SOLD
5456-62043-0011.flac,WOOD'S RIZ SINCE YOU WENT DOWN TWO WEEKS AGO BESIDES YOU ARE AWAR THAT YOU VERY SELDOM STOP GOING DOWN
5456-62043-0012.flac,AND THERE'S NO OTHER WOODYARD FOR NINE MILES AHEAD AND IF YOU HAPPEN TO BE NEARLY OUT OF FOOEL WHY WELL WELL INTERRUPTED THE CAPTAIN WE'LL TAKE A FEW CORDS UNDER THE CIRCUMSTANCES AND HE RETURNED TO HIS GAME OF BRAG
5456-62043-0013.flac,IN ABOUT HALF AN HOUR WE FELT THE CARAVAN COMMENCE PADDLING AGAIN SUPPER WAS OVER
5456-62043-0014.flac,SITUATED ALONGSIDE AND OVERLOOKING THE BRAG TABLE WHERE THE CAPTAIN WAS DEEPLY ENGAGED HAVING NOW THE OTHER PILOT AS HIS PRINCIPAL OPPONENT WE JOGGED ON QUIETLY AND SEEMED TO BE GOING AT A GOOD RATE
5456-62043-0015.flac,HOW DOES THAT WOOD BURN INQUIRED THE CAPTAIN OF THE MATE WHO WAS LOOKING ON AT THE GAME TISN'T OF MUCH ACCOUNT I RECKON ANSWERED THE MATE IT'S COTTONWOOD AND MOST OF IT GREEN AT THAT WELL THOMPSON THREE ACES AGAIN STRANGER
5456-62043-0016.flac,THOMPSON I SAY WE'D BETTER TAKE THREE OR FOUR CORDS AT THE NEXT WOODYARD IT CAN'T BE MORE THAN SIX MILES FROM HERE TWO ACES AND A BRAGGER WITH THE AGE
5456-62043-0017.flac,THE GAME WENT ON AND THE PADDLES KEPT MOVING AT ELEVEN O'CLOCK IT WAS REPORTED TO THE CAPTAIN THAT WE WERE NEARING THE WOODYARD THE LIGHT BEING DISTINCTLY SEEN BY THE PILOT ON DUTY HEAD HER IN SHORE THEN AND TAKE IN SIX CORDS IF IT'S GOOD SEE TO IT THOMPSON
5456-62043-0018.flac,I CAN'T VERY WELL LEAVE THE GAME NOW IT'S GETTING RIGHT WARM THIS PILOT'S BEATING US ALL TO SMASH THE WOODING COMPLETED WE PADDLED ON AGAIN THE CAPTAIN SEEMED SOMEWHAT VEXED WHEN THE MATE INFORMED HIM THAT THE PRICE WAS THE SAME AS AT THE LAST WOODYARD
5456-62043-0019.flac,THREE AND A QUARTER BUT SOON AGAIN BECAME INTERESTED IN THE GAME FROM MY UPPER BERTH THERE WERE NO STATE ROOMS THEN I COULD OBSERVE THE MOVEMENTS OF THE PLAYERS
5456-62043-0020.flac,THE LATTER PERSONAGES TOOK IT TURN AND TURN ABOUT STEERING AND PLAYING BRAG ONE OF THEM ALMOST INVARIABLY WINNING WHILE THE TWO PASSENGERS MERELY WENT THROUGH THE CEREMONY OF DEALING CUTTING AND PAYING UP THEIR ANTIES THEY WERE ANXIOUS TO LEARN THE GAME
5456-62043-0021.flac,AND THEY DID LEARN IT ONCE IN A WHILE INDEED SEEING THEY HAD TWO ACES AND A BRAGGER THEY WOULD VENTURE A BET OF FIVE OR TEN DOLLARS BUT THEY WERE ALWAYS COMPELLED TO BACK OUT BEFORE THE TREMENDOUS BRAGGING OF THE CAPTAIN OR PILOT
5456-62043-0022.flac,OR IF THEY DID VENTURE TO CALL OUT ON TWO BULLITS AND A BRAGGER THEY HAD THE MORTIFICATION TO FIND ONE OF THE OFFICERS HAD THE SAME KIND OF A HAND AND WERE MORE VENERABLE STILL WITH ALL THESE DISADVANTAGES THEY CONTINUED PLAYING
5456-62043-0023.flac,THEY WANTED TO LEARN THE GAME AT TWO O'CLOCK THE CAPTAIN ASKED THE MATE HOW WE WERE GETTING ON OH PRETTY GLIBLY SIR REPLIED THE MATE WE CAN SCARCELY TELL WHAT HEADWAY WE ARE MAKING FOR WE ARE OBLIGED TO KEEP THE MIDDLE OF THE RIVER AND THERE IS THE SHADOW OF A FOG RISING
5456-62043-0024.flac,THIS WOOD SEEMS RATHER BETTER THAN THAT WE TOOK IN AT YELLOW FACE'S BUT WE'RE NEARLY OUT AGAIN AND MUST BE LOOKING OUT FOR MORE I SAW A LIGHT JUST AHEAD ON THE RIGHT SHALL WE HAIL YES YES REPLIED THE CAPTAIN RING THE BELL AND ASK EM WHAT'S THE PRICE OF WOOD UP HERE I'VE GOT YOU AGAIN
5456-62043-0025.flac,I HEARD THE BELL AND THE PILOT'S HAIL WHAT'S YOUR PRICE FOR WOOD A YOUTHFUL VOICE ON THE SHORE ANSWERED THREE AND A QUARTER D NET EJACULATED THE CAPTAIN
5456-62043-0026.flac,THE STRANGERS SUFFERING SOME AT THE SAME TIME THREE AND A QUARTER AGAIN ARE WE NEVER TO GET TO A CHEAPER COUNTRY DEAL SIR IF YOU PLEASE BETTER LUCK NEXT TIME THE OTHER PILOT'S VOICE WAS AGAIN HEARD ON DECK HOW MUCH HAVE YOU ONLY ABOUT TEN CORDS SIR
5456-62043-0027.flac,WAS THE REPLY OF THE YOUTHFUL SALESMAN THE CAPTAIN HERE TOLD THOMPSON TO TAKE SIX CORDS WHICH WOULD LAST TILL DAYLIGHT AND AGAIN TURNED HIS ATTENTION TO THE GAME THE PILOTS HERE CHANGED PLACES WHEN DID THEY SLEEP WOOD TAKEN IN
5456-62043-0028.flac,THE CARAVAN AGAIN TOOK HER PLACE IN THE MIDDLE OF THE STREAM PADDLING ON AS USUAL DAY AT LENGTH DAWNED THE BRAG PARTY BROKE UP AND SETTLEMENTS WERE BEING MADE DURING WHICH OPERATION
5456-62043-0029.flac,THE CAPTAIN'S BRAGGING PROPENSITIES WERE EXERCISED IN CRACKING UP THE SPEED OF HIS BOAT WHICH BY HIS RECKONING
5456-62043-0030.flac,IT APPEARS THE TWO PASSENGERS IN THEIR FIRST LESSON HAD INCIDENTALLY LOST ONE HUNDRED AND TWENTY DOLLARS THE CAPTAIN AS HE ROSE TO SEE ABOUT TAKING IN SOME GOOD WOOD WHICH HE FELT SURE OF OBTAINING NOW THAT HE HAD GOT ABOVE THE LEVEL COUNTRY WINKED AT HIS OPPONENT
5456-62043-0031.flac,THE PILOT WITH WHOM HE HAD BEEN ON VERY BAD TERMS DURING THE PROGRESS OF THE GAME AND SAID IN AN UNDERTONE FORTY APIECE FOR YOU AND I AND JAMES THE OTHER PILOT IS NOT BAD FOR ONE NIGHT I HAD RISEN AND WENT OUT WITH THE CAPTAIN TO ENJOY A VIEW OF THE BLUFFS
5456-62043-0032.flac,THERE WAS JUST FOG ENOUGH TO PREVENT THE VISION TAKING IN MORE THAN SIXTY YARDS SO I WAS DISAPPOINTED IN MY EXPECTATION WE WERE NEARING THE SHORE FOR THE PURPOSE OF LOOKING FOR WOOD THE BANKS BEING INVISIBLE FROM THE MIDDLE OF THE RIVER THERE IT IS EXCLAIMED THE CAPTAIN STOP HER
5456-62043-0033.flac,AND THE CAPTAIN HAILED HALLO THE WOODYARD HALLO YOURSELF ANSWERED A SQUEAKING FEMALE VOICE WHICH CAME FROM A WOMAN WITH A PETTICOAT OVER HER SHOULDERS IN PLACE OF A SHAWL WHAT'S THE PRICE OF WOOD
5456-62043-0034.flac,I THINK YOU OUGHT TO KNOW THE PRICE BY THIS TIME ANSWERED THE OLD LADY IN THE PETTICOAT
5456-62043-0035.flac,AND NOW YOU KNOW IT THREE AND THE D L BROKE IN THE CAPTAIN WHAT HAVE YOU RAISED ON YOUR WOOD TOO I'LL GIVE YOU THREE AND NOT A CENT MORE WELL REPLIED THE PETTICOAT HERE COMES THE OLD MAN HE'LL TALK TO YOU AND SURE ENOUGH
5456-62043-0036.flac,OUT CREPT FROM THE COTTAGE THE VERITABLE FADED HAT COPPERAS COLORED PANTS YELLOW COUNTENANCE AND TWO WEEKS BEARD WE HAD SEEN THE NIGHT BEFORE
5456-62043-0037.flac,ACCOMPANIED BY THE SAME LEER OF THE SAME YELLOW COUNTENANCE WHY DARN IT ALL CAPTING THERE IS BUT THREE OR FOUR CORDS LEFT AND SINCE IT'S YOU I DON'T CARE IF I DO LET YOU HAVE IT FOR THREE AS YOU'RE A GOOD CUSTOMER
5456-62043-0038.flac,AND TURNED IN TO TAKE SOME REST THE FACT BECAME APPARENT THE READER WILL PROBABLY HAVE DISCOVERED IT SOME TIME SINCE
5456-24741-0000.flac,THE IDEA OF EVERY MODE IN WHICH THE HUMAN BODY IS AFFECTED BY EXTERNAL BODIES
5456-24741-0001.flac,PROOF ALL THE MODES IN WHICH ANY GIVEN BODY IS AFFECTED
5456-24741-0002.flac,WHEREFORE THEIR IDEA ALSO NECESSARILY
5456-24741-0003.flac,THEREFORE THE IDEA OF EVERY MODE IN WHICH THE HUMAN BODY IS AFFECTED BY EXTERNAL BODIES INVOLVES THE NATURE OF THE HUMAN BODY AND OF THE EXTERNAL BODY
5456-24741-0004.flac,HENCE IT FOLLOWS FIRST THAT THE HUMAN MIND PERCEIVES THE NATURE OF A VARIETY OF BODIES TOGETHER WITH THE NATURE OF ITS OWN
5456-24741-0005.flac,IT WILL HAVE THE IDEA OF THE MODE AS ACTUALLY EXISTING
5456-24741-0006.flac,IN OTHER WORDS IT WILL HAVE THE IDEA WHICH DOES NOT EXCLUDE BUT POSTULATES THE EXISTENCE OR PRESENCE OF THE NATURE OF THE EXTERNAL BODY
5456-24741-0007.flac,WILL REGARD THE EXTERNAL BODY AS ACTUALLY EXISTING
5456-24741-0008.flac,COROLLARY THE MIND IS ABLE TO REGARD AS PRESENT EXTERNAL BODIES BY WHICH THE HUMAN BODY HAS ONCE BEEN AFFECTED EVEN THOUGH THEY BE NO LONGER IN EXISTENCE OR PRESENT
5456-24741-0009.flac,BY WHICH THE HUMAN BODY HAS ONCE BEEN AFFECTED BE NO LONGER IN EXISTENCE THE MIND WILL NEVERTHELESS REGARD THEM AS PRESENT AS OFTEN AS THIS ACTION OF THE BODY IS REPEATED
5456-24741-0010.flac,NOTE WE THUS SEE HOW IT COMES ABOUT
5456-24741-0011.flac,THE LATTER INDICATES RATHER THE DISPOSITION OF PAUL'S BODY THAN THE NATURE OF PETER AND THEREFORE WHILE THIS DISPOSITION OF PAUL'S BODY LASTS PAUL'S MIND WILL REGARD PETER AS PRESENT TO ITSELF EVEN THOUGH HE NO LONGER EXISTS FURTHER TO RETAIN THE USUAL PHRASEOLOGY
5456-24741-0012.flac,THE MODIFICATIONS OF THE HUMAN BODY OF WHICH THE IDEAS REPRESENT EXTERNAL BODIES AS PRESENT TO US WE WILL CALL THE IMAGES OF THINGS THOUGH THEY DO NOT RECALL THE FIGURE OF THINGS WHEN THE MIND REGARDS BODIES IN THIS FASHION WE SAY THAT IT IMAGINES
5456-24741-0013.flac,LOOKED AT IN THEMSELVES DO NOT CONTAIN ERROR THE MIND DOES NOT ERR IN THE MERE ACT OF IMAGINING BUT ONLY IN SO FAR AS IT IS REGARDED AS BEING WITHOUT THE IDEA
5456-24741-0014.flac,WHICH ASSOCIATION ARISES IN THE MIND ACCORDING TO THE ORDER AND ASSOCIATION OF THE MODIFICATIONS AFFECTIONES OF THE HUMAN BODY I SAY FIRST IT IS AN ASSOCIATION OF THOSE IDEAS ONLY
5456-24741-0015.flac,IDEAS OF THE MODIFICATIONS OF THE HUMAN BODY ARE STRICTLY SPEAKING
5456-24741-0016.flac,THOSE WHICH INVOLVE THE NATURE BOTH OF THE HUMAN BODY AND OF EXTERNAL BODIES I SAY SECONDLY
5456-24741-0017.flac,IN ORDER TO DISTINGUISH IT FROM THAT ASSOCIATION OF IDEAS
5456-24741-0018.flac,WHEREBY THE MIND PERCEIVES THINGS THROUGH THEIR PRIMARY CAUSES
5456-24741-0019.flac,AND HENCE WE CAN FURTHER CLEARLY UNDERSTAND WHY THE MIND FROM THE THOUGHT OF ONE THING SHOULD STRAIGHTWAY ARRIVE AT THE THOUGHT OF ANOTHER THING WHICH HAS NO SIMILARITY WITH THE FIRST FOR INSTANCE FROM THE THOUGHT OF THE WORD POMUM AN APPLE
5456-24741-0020.flac,A ROMAN WOULD STRAIGHTWAY ARRIVE AT THE THOUGHT OF THE FRUIT APPLE WHICH HAS NO SIMILITUDE WITH THE ARTICULATE SOUND IN QUESTION NOR ANYTHING IN COMMON WITH IT
5456-24741-0021.flac,THAT IS THAT THE MAN HAS OFTEN HEARD THE WORD POMUM WHILE HE WAS LOOKING AT THE FRUIT
5456-24741-0022.flac,OR THE HUMAN MIND PERCEIVES THOSE MODIFICATIONS
5456-24741-0023.flac,THE HUMAN BODY ITSELF AND AS ACTUALLY EXISTING THEREFORE THE MIND PERCEIVES THUS FAR ONLY THE HUMAN BODY
5456-24741-0024.flac,FOLLOWING IN GOD IN THE SAME MANNER AND BEING REFERRED TO GOD IN THE SAME MANNER AS THE IDEA OR KNOWLEDGE OF THE HUMAN BODY PROOF
481-123720-0000.flac,ALL OF THEM TOOK SCARCELY ANY NOTICE OF MY ENTRANCE WHICH WAS STRANGE FOR I HAD NOT MET THEM FOR YEARS EVIDENTLY THEY LOOKED UPON ME AS SOMETHING ON THE LEVEL OF A COMMON FLY I HAD NOT BEEN TREATED LIKE THAT EVEN AT SCHOOL THOUGH THEY ALL HATED ME
481-123720-0001.flac,I KNEW OF COURSE THAT THEY MUST DESPISE ME NOW FOR MY LACK OF SUCCESS IN THE SERVICE AND FOR MY HAVING LET MYSELF SINK SO LOW GOING ABOUT BADLY DRESSED AND SO ON WHICH SEEMED TO THEM A SIGN OF MY INCAPACITY AND INSIGNIFICANCE
481-123720-0002.flac,BUT I HAD NOT EXPECTED SUCH CONTEMPT SIMONOV WAS POSITIVELY SURPRISED AT MY TURNING UP
481-123720-0003.flac,ALL THIS DISCONCERTED ME I SAT DOWN FEELING RATHER MISERABLE AND BEGAN LISTENING TO WHAT THEY WERE SAYING THEY WERE ENGAGED IN WARM AND EARNEST CONVERSATION ABOUT A FAREWELL DINNER WHICH THEY WANTED TO ARRANGE FOR THE NEXT DAY TO A COMRADE OF THEIRS CALLED ZVERKOV
481-123720-0004.flac,THIS ZVERKOV HAD BEEN ALL THE TIME AT SCHOOL WITH ME TOO I HAD BEGUN TO HATE HIM PARTICULARLY IN THE UPPER FORMS IN THE LOWER FORMS HE HAD SIMPLY BEEN A PRETTY PLAYFUL BOY WHOM EVERYBODY LIKED I HAD HATED HIM HOWEVER EVEN IN THE LOWER FORMS
481-123720-0005.flac,JUST BECAUSE HE WAS A PRETTY AND PLAYFUL BOY HE WAS ALWAYS BAD AT HIS LESSONS AND GOT WORSE AND WORSE AS HE WENT ON HOWEVER HE LEFT WITH A GOOD CERTIFICATE AS HE HAD POWERFUL INTERESTS DURING HIS LAST YEAR AT SCHOOL HE CAME IN FOR AN ESTATE OF TWO HUNDRED SERFS
481-123720-0006.flac,AND AS ALMOST ALL OF US WERE POOR HE TOOK UP A SWAGGERING TONE AMONG US HE WAS VULGAR IN THE EXTREME BUT AT THE SAME TIME HE WAS A GOOD NATURED FELLOW EVEN IN HIS SWAGGERING
481-123720-0007.flac,IN SPITE OF SUPERFICIAL FANTASTIC AND SHAM NOTIONS OF HONOUR AND DIGNITY ALL BUT VERY FEW OF US POSITIVELY GROVELLED BEFORE ZVERKOV AND THE MORE SO THE MORE HE SWAGGERED AND IT WAS NOT FROM ANY INTERESTED MOTIVE
481-123720-0008.flac,BUT SIMPLY BECAUSE HE HAD BEEN FAVOURED BY THE GIFTS OF NATURE MOREOVER IT WAS AS IT WERE AN ACCEPTED IDEA AMONG US THAT ZVERKOV WAS A SPECIALIST IN REGARD TO TACT AND THE SOCIAL GRACES THIS LAST FACT PARTICULARLY INFURIATED ME
481-123720-0009.flac,I HATED THE ABRUPT SELF CONFIDENT TONE OF HIS VOICE HIS ADMIRATION OF HIS OWN WITTICISMS
481-123720-0010.flac,THOUGH HE WAS BOLD IN HIS LANGUAGE I HATED HIS HANDSOME BUT STUPID FACE FOR WHICH I WOULD HOWEVER HAVE GLADLY EXCHANGED MY INTELLIGENT ONE AND THE FREE AND EASY MILITARY MANNERS IN FASHION IN THE FORTIES
481-123720-0011.flac,I HATED THE WAY IN WHICH HE USED TO TALK OF HIS FUTURE CONQUESTS OF WOMEN HE DID NOT VENTURE TO BEGIN HIS ATTACK UPON WOMEN UNTIL HE HAD THE EPAULETTES OF AN OFFICER AND WAS LOOKING FORWARD TO THEM WITH IMPATIENCE AND BOASTED OF THE DUELS HE WOULD CONSTANTLY BE FIGHTING
481-123720-0012.flac,I REMEMBER HOW I INVARIABLY SO TACITURN SUDDENLY FASTENED UPON ZVERKOV WHEN ONE DAY TALKING AT A LEISURE MOMENT WITH HIS SCHOOLFELLOWS OF HIS FUTURE RELATIONS WITH THE FAIR SEX AND GROWING AS SPORTIVE AS A PUPPY IN THE SUN
481-123720-0013.flac,HE ALL AT ONCE DECLARED THAT HE WOULD NOT LEAVE A SINGLE VILLAGE GIRL ON HIS ESTATE UNNOTICED
481-123720-0014.flac,AND THAT IF THE PEASANTS DARED TO PROTEST HE WOULD HAVE THEM ALL FLOGGED AND DOUBLE THE TAX ON THEM THE BEARDED RASCALS OUR SERVILE RABBLE APPLAUDED BUT I ATTACKED HIM NOT FROM COMPASSION FOR THE GIRLS AND THEIR FATHERS
481-123720-0015.flac,BUT SIMPLY BECAUSE THEY WERE APPLAUDING SUCH AN INSECT I GOT THE BETTER OF HIM ON THAT OCCASION BUT THOUGH ZVERKOV WAS STUPID HE WAS LIVELY AND IMPUDENT AND SO LAUGHED IT OFF AND IN SUCH A WAY THAT MY VICTORY WAS NOT REALLY COMPLETE
481-123720-0016.flac,THE LAUGH WAS ON HIS SIDE HE GOT THE BETTER OF ME ON SEVERAL OCCASIONS AFTERWARDS BUT WITHOUT MALICE JESTINGLY CASUALLY I REMAINED ANGRILY AND CONTEMPTUOUSLY SILENT AND WOULD NOT ANSWER HIM WHEN WE LEFT SCHOOL HE MADE ADVANCES TO ME
481-123720-0017.flac,I DID NOT REBUFF THEM FOR I WAS FLATTERED BUT WE SOON PARTED AND QUITE NATURALLY AFTERWARDS I HEARD OF HIS BARRACK ROOM SUCCESS AS A LIEUTENANT AND OF THE FAST LIFE HE WAS LEADING THEN THERE CAME OTHER RUMOURS
481-123720-0018.flac,BY THEN HE HAD TAKEN TO CUTTING ME IN THE STREET AND I SUSPECTED THAT HE WAS AFRAID OF COMPROMISING HIMSELF BY GREETING A PERSONAGE AS INSIGNIFICANT AS ME I SAW HIM ONCE IN THE THEATRE IN THE THIRD TIER OF BOXES
481-123720-0019.flac,BY THEN HE WAS WEARING SHOULDER STRAPS HE WAS TWISTING AND TWIRLING ABOUT INGRATIATING HIMSELF WITH THE DAUGHTERS OF AN ANCIENT GENERAL IN THREE YEARS HE HAD GONE OFF CONSIDERABLY THOUGH HE WAS STILL RATHER HANDSOME AND ADROIT
481-123720-0020.flac,ONE COULD SEE THAT BY THE TIME HE WAS THIRTY HE WOULD BE CORPULENT
481-123720-0021.flac,THEY HAD KEPT UP WITH HIM FOR THOSE THREE YEARS THOUGH PRIVATELY THEY DID NOT CONSIDER THEMSELVES ON AN EQUAL FOOTING WITH HIM I AM CONVINCED OF THAT OF SIMONOV'S TWO VISITORS ONE WAS FERFITCHKIN A RUSSIANISED GERMAN
481-123720-0022.flac,A LITTLE FELLOW WITH THE FACE OF A MONKEY A BLOCKHEAD WHO WAS ALWAYS DERIDING EVERYONE A VERY BITTER ENEMY OF MINE FROM OUR DAYS IN THE LOWER FORMS A VULGAR IMPUDENT SWAGGERING FELLOW WHO AFFECTED A MOST SENSITIVE FEELING
481-123720-0023.flac,OF PERSONAL HONOUR THOUGH OF COURSE HE WAS A WRETCHED LITTLE COWARD AT HEART HE WAS ONE OF THOSE WORSHIPPERS OF ZVERKOV WHO MADE UP TO THE LATTER FROM INTERESTED MOTIVES AND OFTEN BORROWED MONEY FROM HIM SIMONOV'S OTHER VISITOR TRUDOLYUBOV WAS A PERSON IN NO WAY REMARKABLE
481-123720-0024.flac,A TALL YOUNG FELLOW IN THE ARMY WITH A COLD FACE FAIRLY HONEST THOUGH HE WORSHIPPED SUCCESS OF EVERY SORT AND WAS ONLY CAPABLE OF THINKING OF PROMOTION HE WAS SOME SORT OF DISTANT RELATION OF ZVERKOV'S AND THIS
481-123720-0025.flac,GAVE HIM A CERTAIN IMPORTANCE AMONG US HE ALWAYS THOUGHT ME OF NO CONSEQUENCE WHATEVER HIS BEHAVIOUR TO ME THOUGH NOT QUITE COURTEOUS WAS TOLERABLE WELL WITH SEVEN ROUBLES EACH SAID TRUDOLYUBOV TWENTY ONE ROUBLES BETWEEN THE THREE OF US
481-123720-0026.flac,WE OUGHT TO BE ABLE TO GET A GOOD DINNER ZVERKOV OF COURSE WON'T PAY OF COURSE NOT SINCE WE ARE INVITING HIM SIMONOV DECIDED CAN YOU IMAGINE FERFITCHKIN INTERRUPTED HOTLY AND CONCEITEDLY
481-123720-0027.flac,LIKE SOME INSOLENT FLUNKEY BOASTING OF HIS MASTER THE GENERAL'S DECORATIONS CAN YOU IMAGINE THAT ZVERKOV WILL LET US PAY ALONE HE WILL ACCEPT FROM DELICACY
481-123720-0028.flac,SO THE THREE OF US WITH ZVERKOV FOR THE FOURTH
481-123720-0029.flac,SIMONOV WHO HAD BEEN ASKED TO MAKE THE ARRANGEMENTS CONCLUDED FINALLY HOW TWENTY ONE ROUBLES I ASKED IN SOME AGITATION WITH A SHOW OF BEING OFFENDED
481-123720-0030.flac,TWENTY EIGHT ROUBLES IT SEEMED TO ME THAT TO INVITE MYSELF SO SUDDENLY AND UNEXPECTEDLY WOULD BE POSITIVELY GRACEFUL AND THAT THEY WOULD ALL BE CONQUERED AT ONCE
481-123720-0031.flac,DO YOU WANT TO JOIN TOO SIMONOV OBSERVED WITH NO APPEARANCE OF PLEASURE SEEMING TO AVOID LOOKING AT ME HE KNEW ME THROUGH AND THROUGH IT INFURIATED ME THAT HE KNEW ME SO THOROUGHLY WHY NOT
481-123720-0032.flac,I AM AN OLD SCHOOLFELLOW OF HIS TOO I BELIEVE AND I MUST OWN I FEEL HURT THAT YOU HAVE LEFT ME OUT I SAID BOILING OVER AGAIN AND WHERE WERE WE TO FIND YOU FERFITCHKIN PUT IN ROUGHLY YOU NEVER WERE ON GOOD TERMS WITH ZVERKOV TRUDOLYUBOV ADDED FROWNING
481-123720-0033.flac,BUT I HAD ALREADY CLUTCHED AT THE IDEA AND WOULD NOT GIVE IT UP IT SEEMS TO ME THAT NO ONE HAS A RIGHT TO FORM AN OPINION UPON THAT I RETORTED IN A SHAKING VOICE AS THOUGH SOMETHING TREMENDOUS HAD HAPPENED PERHAPS THAT IS JUST MY REASON FOR WISHING IT NOW
481-123720-0034.flac,THAT I HAVE NOT ALWAYS BEEN ON GOOD TERMS WITH HIM OH THERE'S NO MAKING YOU OUT WITH THESE REFINEMENTS TRUDOLYUBOV JEERED WE'LL PUT YOUR NAME DOWN SIMONOV DECIDED ADDRESSING ME
481-123720-0035.flac,WHAT ABOUT THE MONEY FERFITCHKIN BEGAN IN AN UNDERTONE INDICATING ME TO SIMONOV BUT HE BROKE OFF FOR EVEN SIMONOV WAS EMBARRASSED THAT WILL DO SAID TRUDOLYUBOV GETTING UP IF HE WANTS TO COME SO MUCH LET HIM
481-123720-0036.flac,BUT IT'S A PRIVATE THING BETWEEN US FRIENDS FERFITCHKIN SAID CROSSLY AS HE TOO PICKED UP HIS HAT IT'S NOT AN OFFICIAL GATHERING WE DO NOT WANT AT ALL PERHAPS THEY WENT AWAY FERFITCHKIN DID NOT GREET ME IN ANY WAY AS HE WENT OUT
481-123720-0037.flac,TRUDOLYUBOV BARELY NODDED SIMONOV WITH WHOM I WAS LEFT TETE A TETE WAS IN A STATE OF VEXATION AND PERPLEXITY AND LOOKED AT ME QUEERLY
481-123720-0038.flac,WILL YOU PAY YOUR SUBSCRIPTION NOW I JUST ASK SO AS TO KNOW HE MUTTERED IN EMBARRASSMENT I FLUSHED CRIMSON AS I DID SO I REMEMBERED THAT I HAD OWED SIMONOV FIFTEEN ROUBLES FOR AGES
481-123720-0039.flac,WHICH I HAD INDEED NEVER FORGOTTEN THOUGH I HAD NOT PAID IT
481-123720-0040.flac,VEXED THAT I HAVE FORGOTTEN ALL RIGHT ALL RIGHT THAT DOESN'T MATTER YOU CAN PAY TOMORROW AFTER THE DINNER I SIMPLY WANTED TO KNOW PLEASE DON'T HE BROKE OFF AND BEGAN PACING THE ROOM STILL MORE VEXED AS HE WALKED HE BEGAN TO STAMP WITH HIS HEELS
481-123720-0041.flac,AM I KEEPING YOU I ASKED AFTER TWO MINUTES OF SILENCE
481-123720-0042.flac,THAT IS TO BE TRUTHFUL YES I HAVE TO GO AND SEE SOMEONE NOT FAR FROM HERE
481-123720-0043.flac,MY GOODNESS WHY DIDN'T YOU SAY SO I CRIED
481-123720-0044.flac,IT'S CLOSE BY NOT TWO PACES AWAY SIMONOV REPEATED ACCOMPANYING ME TO THE FRONT DOOR WITH A FUSSY AIR WHICH DID NOT SUIT HIM AT ALL
481-123720-0045.flac,HE WAS VERY GLAD TO GET RID OF ME I WAS IN A FURY WHAT POSSESSED ME WHAT POSSESSED ME TO FORCE MYSELF UPON THEM I WONDERED GRINDING MY TEETH AS I STRODE ALONG THE STREET FOR A SCOUNDREL A PIG LIKE THAT ZVERKOV OF COURSE
481-123720-0046.flac,I HAD BETTER NOT GO OF COURSE I MUST JUST SNAP MY FINGERS AT THEM
481-123720-0047.flac,BUT WHAT MADE ME FURIOUS WAS THAT I KNEW FOR CERTAIN THAT I SHOULD GO THAT I SHOULD MAKE A POINT OF GOING AND THE MORE TACTLESS THE MORE UNSEEMLY MY GOING WOULD BE THE MORE CERTAINLY I WOULD GO AND THERE WAS A POSITIVE OBSTACLE TO MY GOING
481-123720-0048.flac,I HAD NO MONEY ALL I HAD WAS NINE ROUBLES I HAD TO GIVE SEVEN OF THAT TO MY SERVANT APOLLON FOR HIS MONTHLY WAGES THAT WAS ALL I PAID HIM HE HAD TO KEEP HIMSELF
481-123720-0049.flac,NOT TO PAY HIM WAS IMPOSSIBLE CONSIDERING HIS CHARACTER BUT I WILL TALK ABOUT THAT FELLOW ABOUT THAT PLAGUE OF MINE ANOTHER TIME HOWEVER I KNEW I SHOULD GO AND SHOULD NOT PAY HIM HIS WAGES THAT NIGHT I HAD THE MOST HIDEOUS DREAMS
481-123720-0050.flac,I WAS SENT TO THE SCHOOL BY DISTANT RELATIONS UPON WHOM I WAS DEPENDENT AND OF WHOM I HAVE HEARD NOTHING SINCE THEY SENT ME THERE A FORLORN SILENT BOY ALREADY CRUSHED BY THEIR REPROACHES ALREADY TROUBLED BY DOUBT
481-123720-0051.flac,AND LOOKING WITH SAVAGE DISTRUST AT EVERYONE MY SCHOOLFELLOWS MET ME WITH SPITEFUL AND MERCILESS JIBES BECAUSE I WAS NOT LIKE ANY OF THEM BUT I COULD NOT ENDURE THEIR TAUNTS
481-123720-0052.flac,I COULD NOT GIVE IN TO THEM WITH THE IGNOBLE READINESS WITH WHICH THEY GAVE IN TO ONE ANOTHER I HATED THEM FROM THE FIRST AND SHUT MYSELF AWAY FROM EVERYONE IN TIMID WOUNDED AND DISPROPORTIONATE PRIDE
481-123720-0053.flac,THEIR COARSENESS REVOLTED ME THEY LAUGHED CYNICALLY AT MY FACE AT MY CLUMSY FIGURE AND YET WHAT STUPID FACES THEY HAD THEMSELVES IN OUR SCHOOL THE BOYS FACES SEEMED IN A SPECIAL WAY TO DEGENERATE AND GROW STUPIDER
481-123720-0054.flac,HOW MANY FINE LOOKING BOYS CAME TO US IN A FEW YEARS THEY BECAME REPULSIVE EVEN AT SIXTEEN I WONDERED AT THEM MOROSELY EVEN THEN I WAS STRUCK BY THE PETTINESS OF THEIR THOUGHTS THE STUPIDITY OF THEIR PURSUITS
481-123720-0055.flac,THEIR GAMES THEIR CONVERSATIONS THEY HAD NO UNDERSTANDING OF SUCH ESSENTIAL THINGS THEY TOOK NO INTEREST IN SUCH STRIKING IMPRESSIVE SUBJECTS THAT I COULD NOT HELP CONSIDERING THEM INFERIOR TO MYSELF
481-123720-0056.flac,IT WAS NOT WOUNDED VANITY THAT DROVE ME TO IT AND FOR GOD'S SAKE DO NOT THRUST UPON ME YOUR HACKNEYED REMARKS REPEATED TO NAUSEA THAT I WAS ONLY A DREAMER WHILE THEY EVEN THEN HAD AN UNDERSTANDING OF LIFE
481-123720-0057.flac,THEY TOOK RANK FOR INTELLIGENCE EVEN AT SIXTEEN THEY WERE ALREADY TALKING ABOUT A SNUG BERTH OF COURSE A GREAT DEAL OF IT WAS DUE TO THEIR STUPIDITY TO THE BAD EXAMPLES WITH WHICH THEY HAD ALWAYS BEEN SURROUNDED IN THEIR CHILDHOOD AND BOYHOOD
481-123720-0058.flac,THEY WERE MONSTROUSLY DEPRAVED OF COURSE A GREAT DEAL OF THAT TOO WAS SUPERFICIAL AND AN ASSUMPTION OF CYNICISM OF COURSE THERE WERE GLIMPSES OF YOUTH AND FRESHNESS EVEN IN THEIR DEPRAVITY BUT EVEN THAT FRESHNESS WAS NOT ATTRACTIVE
481-123720-0059.flac,AND SHOWED ITSELF IN A CERTAIN RAKISHNESS I HATED THEM HORRIBLY THOUGH PERHAPS I WAS WORSE THAN ANY OF THEM THEY REPAID ME IN THE SAME WAY AND DID NOT CONCEAL THEIR AVERSION FOR ME BUT BY THEN I DID NOT DESIRE THEIR AFFECTION
481-123720-0060.flac,ON THE CONTRARY I CONTINUALLY LONGED FOR THEIR HUMILIATION TO ESCAPE FROM THEIR DERISION I PURPOSELY BEGAN TO MAKE ALL THE PROGRESS I COULD WITH MY STUDIES AND FORCED MY WAY TO THE VERY TOP THIS IMPRESSED THEM
481-123720-0061.flac,MOREOVER THEY ALL BEGAN BY DEGREES TO GRASP THAT I HAD ALREADY READ BOOKS NONE OF THEM COULD READ AND UNDERSTOOD THINGS NOT FORMING PART OF OUR SCHOOL CURRICULUM OF WHICH THEY HAD NOT EVEN HEARD THEY TOOK A SAVAGE AND SARCASTIC VIEW OF IT
481-123720-0062.flac,BUT WERE MORALLY IMPRESSED ESPECIALLY AS THE TEACHERS BEGAN TO NOTICE ME ON THOSE GROUNDS THE MOCKERY CEASED BUT THE HOSTILITY REMAINED AND COLD AND STRAINED RELATIONS BECAME PERMANENT BETWEEN US IN THE END I COULD NOT PUT UP WITH IT
481-123720-0063.flac,WITH YEARS A CRAVING FOR SOCIETY FOR FRIENDS DEVELOPED IN ME I ATTEMPTED TO GET ON FRIENDLY TERMS WITH SOME OF MY SCHOOLFELLOWS BUT SOMEHOW OR OTHER MY INTIMACY WITH THEM WAS ALWAYS STRAINED AND SOON ENDED OF ITSELF
481-123720-0064.flac,ONCE INDEED I DID HAVE A FRIEND
481-123720-0065.flac,AND REPULSED HIM AS THOUGH ALL I NEEDED HIM FOR WAS TO WIN A VICTORY OVER HIM TO SUBJUGATE HIM AND NOTHING ELSE BUT I COULD NOT SUBJUGATE ALL OF THEM MY FRIEND WAS NOT AT ALL LIKE THEM EITHER HE WAS IN FACT A RARE EXCEPTION
481-123720-0066.flac,THE FIRST THING I DID ON LEAVING SCHOOL WAS TO GIVE UP THE SPECIAL JOB FOR WHICH I HAD BEEN DESTINED SO AS TO BREAK ALL TIES
481-123720-0067.flac,AND GOODNESS KNOWS WHY AFTER ALL THAT I SHOULD GO TRUDGING OFF TO SIMONOV'S EARLY NEXT MORNING I ROUSED MYSELF AND JUMPED OUT OF BED WITH EXCITEMENT AS THOUGH IT WERE ALL ABOUT TO HAPPEN AT ONCE
481-123720-0068.flac,BUT I BELIEVED THAT SOME RADICAL CHANGE IN MY LIFE WAS COMING AND WOULD INEVITABLY COME THAT DAY OWING TO ITS RARITY PERHAPS ANY EXTERNAL EVENT HOWEVER TRIVIAL ALWAYS MADE ME FEEL AS THOUGH SOME RADICAL CHANGE IN MY LIFE WERE AT HAND
481-123720-0069.flac,I WENT TO THE OFFICE HOWEVER AS USUAL BUT SNEAKED AWAY HOME TWO HOURS EARLIER TO GET READY THE GREAT THING I THOUGHT IS NOT TO BE THE FIRST TO ARRIVE OR THEY WILL THINK I AM OVERJOYED AT COMING BUT THERE WERE THOUSANDS OF SUCH
481-123720-0070.flac,AND THEY ALL AGITATED AND OVERWHELMED ME I POLISHED MY BOOTS A SECOND TIME WITH MY OWN HANDS NOTHING IN THE WORLD WOULD HAVE INDUCED APOLLON TO CLEAN THEM TWICE A DAY AS HE CONSIDERED THAT IT WAS MORE THAN HIS DUTIES REQUIRED OF HIM
481-123720-0071.flac,I STOLE THE BRUSHES TO CLEAN THEM FROM THE PASSAGE BEING CAREFUL HE SHOULD NOT DETECT IT FOR FEAR OF HIS CONTEMPT
481-123720-0072.flac,I HAD LET MYSELF GET TOO SLOVENLY MY UNIFORM PERHAPS WAS TIDY BUT I COULD NOT GO OUT TO DINNER IN MY UNIFORM THE WORST OF IT WAS THAT ON THE KNEE OF MY TROUSERS WAS A BIG YELLOW STAIN
481-123720-0073.flac,I HAD A FOREBODING THAT THAT STAIN WOULD DEPRIVE ME OF NINE TENTHS OF MY PERSONAL DIGNITY I KNEW TOO THAT IT WAS VERY POOR TO THINK SO BUT THIS IS NO TIME FOR THINKING NOW I AM IN FOR THE REAL THING I THOUGHT AND MY HEART SANK
481-123720-0074.flac,I KNEW TOO PERFECTLY WELL EVEN THEN THAT I WAS MONSTROUSLY EXAGGERATING THE FACTS BUT HOW COULD I HELP IT
481-123720-0075.flac,WITH DESPAIR I PICTURED TO MYSELF HOW COLDLY AND DISDAINFULLY THAT SCOUNDREL ZVERKOV WOULD MEET ME
