audio,text
4397-15678-0040.flac,THE ROAD LEADS THROUGH MAJESTIC WOODS WITH FERNS TEN FEET HIGH BENEATH SOME OF THE THICKETS AND ACROSS A GRAVELLY PLAIN DEFORESTED BY FIRE MANY YEARS AGO ORANGE LILIES ARE PLENTIFUL
4397-15678-0041.flac,AND HANDSOME SHINING MATS OF THE KINNIKINIC SPRINKLED WITH BRIGHT SCARLET BERRIES FROM A PLACE CALLED HUNT'S AT THE END OF THE WAGON ROAD A TRAIL LEADS THROUGH LUSH DRIPPING WOODS NEVER DRY
4397-15678-0042.flac,WHERE NEVER A DUST PARTICLE FLOATED AND WHERE ALL THE FLOWERS FRESH WITH MIST AND SPRAY ARE WETTER THAN WATER LILIES THE POOL AT THE FOOT OF THE FALL IS A PLACE SURPASSINGLY LOVELY TO LOOK AT WITH THE ENTHUSIASTIC RUSH AND SONG OF THE FALLS
4397-15678-0043.flac,THE MAJESTIC TREES OVERHEAD LEANING OVER THE BRINK LIKE LISTENERS EAGER TO CATCH EVERY WORD OF THE WHITE REFRESHING WATERS
4397-15666-0000.flac,THE GREATER PORTION OF THE CALENDAR SPRINGTIME OF UTAH HAS BEEN WINTER IN ALL THE UPPER CANYONS OF THE MOUNTAINS THE SNOW IS NOW FROM FIVE TO TEN FEET DEEP OR MORE AND MOST OF IT HAS FALLEN SINCE MARCH
4397-15666-0001.flac,ALMOST EVERY OTHER DAY DURING THE LAST THREE WEEKS SMALL LOCAL STORMS HAVE BEEN FALLING ON THE WAHSATCH AND OQUIRRH MOUNTAINS WHILE THE JORDAN VALLEY REMAINED DRY AND SUN FILLED BUT ON THE AFTERNOON OF THURSDAY THE SEVENTEENTH ULTIMO
4397-15666-0002.flac,WIND RAIN AND SNOW FILLED THE WHOLE BASIN DRIVING WILDLY OVER VALLEY AND PLAIN FROM RANGE TO RANGE BESTOWING THEIR BENEFACTIONS IN MOST CORDIAL AND HARMONIOUS STORM MEASURES
4397-15666-0003.flac,WITH BILLOWS OF DUST AND SAND
4397-15666-0004.flac,THE BEGINNING OF THE OUTPOURING OF THE TREASURED WRATH OF THE LORD UPON THE GENTILES FOR THE KILLING OF JOSEPH SMITH TO ME IT SEEMED A CORDIAL OUTPOURING OF NATURE'S LOVE BUT IT IS EASY TO DIFFER WITH SALT LATTER DAYS IN EVERYTHING STORMS WIVES
4397-15666-0005.flac,POLITICS AND RELIGION ABOUT AN HOUR BEFORE THE STORM REACHED THE CITY I WAS SO FORTUNATE AS TO BE OUT WITH A FRIEND ON THE BANKS OF THE JORDAN ENJOYING THE SCENERY CLOUDS WITH PECULIARLY RESTLESS AND SELF CONSCIOUS GESTURES
4397-15666-0006.flac,WERE MARSHALING THEMSELVES ALONG THE MOUNTAIN TOPS AND SENDING OUT LONG OVERLAPPING WINGS ACROSS THE VALLEY AND EVEN WHERE NO CLOUD WAS VISIBLE AN OBSCURING FILM ABSORBED THE SUNLIGHT GIVING RISE TO A COLD BLUISH DARKNESS NEVERTHELESS
4397-15666-0007.flac,AND THEIR MARVELOUS PROFUSION OF ORNATE SCULPTURE WERE MOST IMPRESSIVELY MANIFEST ONE WOULD FANCY THAT A MAN MIGHT BE CLEARLY SEEN WALKING ON THE SNOW AT A DISTANCE OF TWENTY OR THIRTY MILES WHILE WE WERE REVELING IN THIS RARE UNGARISH GRANDEUR
4397-15666-0008.flac,TURNING FROM RANGE TO RANGE STUDYING THE DARKENING SKY AND LISTENING TO THE STILL SMALL VOICES OF THE FLOWERS AT OUR FEET SOME OF THE DENSER CLOUDS CAME DOWN CROWNING AND WREATHING THE HIGHEST PEAKS AND DROPPING LONG GRAY FRINGES
4397-15666-0009.flac,WHOSE SMOOTH LINEAR STRUCTURE SHOWED THAT SNOW WAS BEGINNING TO FALL OF THESE PARTIAL STORMS THERE WERE SOON TEN OR TWELVE ARRANGED IN TWO ROWS WHILE THE MAIN JORDAN VALLEY BETWEEN THEM LAY AS YET IN PROFOUND CALM AT FOUR THIRTY P M
4397-15666-0010.flac,A DARK BROWNISH CLOUD APPEARED CLOSE DOWN ON THE PLAIN TOWARDS THE LAKE EXTENDING FROM THE NORTHERN EXTREMITY OF THE OQUIRRH RANGE IN A NORTHEASTERLY DIRECTION AS FAR AS THE EYE COULD REACH ITS PECULIAR COLOR AND STRUCTURE
4397-15666-0011.flac,EXCITED OUR ATTENTION WITHOUT ENABLING US TO DECIDE CERTAINLY AS TO ITS CHARACTER BUT WE WERE NOT LEFT LONG IN DOUBT FOR IN A FEW MINUTES IT CAME SWEEPING OVER THE VALLEY IN A WILD UPROAR A TORRENT OF WIND THICK WITH SAND AND DUST
4397-15666-0012.flac,ADVANCING WITH A MOST MAJESTIC FRONT ROLLING AND OVERCOMBING LIKE A GIGANTIC SEA WAVE SCARCELY WAS IT IN PLAIN SIGHT ERE IT WAS UPON US RACING ACROSS THE JORDAN OVER THE CITY
4397-15666-0013.flac,AND UP THE SLOPES OF THE WAHSATCH ECLIPSING ALL THE LANDSCAPES IN ITS COURSE THE BENDING TREES THE DUST STREAMERS AND THE WILD ONRUSH OF EVERYTHING MOVABLE GIVING IT AN APPRECIABLE VISIBILITY THAT RENDERED IT GRAND AND INSPIRING
4397-15666-0014.flac,THE CRYSTAL FLAKES FALLING IN THE FOUL STREETS WAS A PITIFUL SIGHT NOTWITHSTANDING THE VAUNTED REFINING INFLUENCES OF TOWNS PURITY OF ALL KINDS PURE HEARTS PURE STREAMS PURE SNOW
4397-15666-0015.flac,MUST HERE BE EXPOSED TO TERRIBLE TRIALS CITY CREEK COMING FROM ITS HIGH GLACIAL FOUNTAINS ENTERS THE STREETS OF THIS MORMON ZION PURE AS AN ANGEL BUT HOW DOES IT LEAVE IT
4397-15666-0016.flac,EVEN ROSES AND LILIES IN GARDENS MOST LOVED ARE TAINTED WITH A THOUSAND IMPURITIES AS SOON AS THEY UNFOLD I HEARD BRIGHAM YOUNG IN THE TABERNACLE THE OTHER DAY WARNING HIS PEOPLE THAT IF THEY DID NOT MEND THEIR MANNERS ANGELS WOULD NOT COME INTO THEIR HOUSES
4397-15666-0017.flac,THOUGH PERCHANCE THEY MIGHT BE SAUNTERING BY WITH LITTLE ELSE TO DO THAN CHAT WITH THEM POSSIBLY THERE MAY BE SALT LAKE FAMILIES SUFFICIENTLY PURE FOR ANGEL SOCIETY BUT I WAS NOT PLEASED WITH THE RECEPTION THEY GAVE THE SMALL SNOW ANGELS THAT GOD SENT AMONG THEM THE OTHER NIGHT
4397-15666-0018.flac,ONLY THE CHILDREN HAILED THEM WITH DELIGHT THE OLD LATTER DAYS SEEMED TO SHUN THEM I SHOULD LIKE TO SEE HOW MISTER YOUNG THE LAKE PROPHET WOULD MEET SUCH MESSENGERS BUT TO RETURN TO THE STORM
4397-15666-0019.flac,TOWARD THE EVENING OF THE EIGHTEENTH IT BEGAN TO WITHER THE SNOWY SKIRTS OF THE WAHSATCH MOUNTAINS APPEARED BENEATH THE LIFTING FRINGES OF THE CLOUDS AND THE SUN SHONE OUT THROUGH COLORED WINDOWS PRODUCING ONE OF THE MOST GLORIOUS AFTER STORM EFFECTS I EVER WITNESSED
4397-15666-0020.flac,LOOKING ACROSS THE JORDAN THE GRAY SAGEY SLOPES FROM THE BASE OF THE OQUIRRH MOUNTAINS WERE COVERED WITH A THICK PLUSHY CLOTH OF GOLD SOFT AND ETHEREAL AS A CLOUD NOT MERELY TINTED AND GILDED LIKE A ROCK WITH AUTUMN SUNSHINE BUT DEEPLY MUFFLED BEYOND RECOGNITION
4397-15666-0021.flac,SURELY NOTHING IN HEAVEN NOR ANY MANSION OF THE LORD IN ALL HIS WORLDS COULD BE MORE GLORIOUSLY CARPETED OTHER PORTIONS OF THE PLAIN WERE FLUSHED WITH RED AND PURPLE AND ALL THE MOUNTAINS AND THE CLOUDS ABOVE THEM WERE PAINTED IN CORRESPONDING LOVELINESS
4397-15666-0022.flac,EARTH AND SKY ROUND AND ROUND THE ENTIRE LANDSCAPE WAS ONE RAVISHING REVELATION OF COLOR INFINITELY VARIED AND INTERBLENDED I HAVE SEEN MANY A GLORIOUS SUNSET BENEATH LIFTING STORM CLOUDS ON THE MOUNTAINS
4397-15666-0023.flac,BUT NOTHING COMPARABLE WITH THIS I FELT AS IF NEW ARRIVED IN SOME OTHER FAR OFF WORLD THE MOUNTAINS THE PLAINS THE SKY ALL SEEMED NEW OTHER EXPERIENCES SEEMED BUT TO HAVE PREPARED ME FOR THIS AS SOULS ARE PREPARED FOR HEAVEN
4397-15666-0024.flac,TRAILED THEIR LUSTROUS FRINGES THROUGH THE PINES AS IF TAKING A LAST VIEW OF THEIR ACCOMPLISHED WORK THEN CAME DARKNESS AND THE GLORIOUS DAY WAS DONE
4397-15666-0025.flac,THEY ARE COVERED WITH COMMON SUNSHINE DOWN HERE ON THE BANKS OF THE JORDAN LARKS AND REDWINGS ARE SWINGING ON THE RUSHES THE BALMY AIR IS INSTINCT WITH IMMORTAL LIFE THE WILD FLOWERS THE GRASS
4397-15666-0026.flac,AND THE FARMERS GRAIN ARE FRESH AS IF LIKE THE SNOW THEY HAD COME OUT OF HEAVEN
2893-139310-0000.flac,THE PEOPLE MARCH HE BECAME AWARE OF SOMEONE URGING A GLASS OF CLEAR FLUID UPON HIS ATTENTION LOOKED UP AND DISCOVERED THIS WAS A DARK YOUNG MAN IN A YELLOW GARMENT HE TOOK THE DOSE FORTHWITH AND IN A MOMENT HE WAS GLOWING
2893-139310-0001.flac,A TALL MAN IN A BLACK ROBE STOOD BY HIS SHOULDER AND POINTED TO THE HALF OPEN DOOR INTO THE HALL THIS MAN WAS SHOUTING CLOSE TO HIS EAR AND YET WHAT WAS SAID WAS INDISTINCT BECAUSE OF THE TREMENDOUS UPROAR FROM THE GREAT THEATRE
2893-139310-0002.flac,BEHIND THE MAN WAS A GIRL IN A SILVERY GREY ROBE WHOM GRAHAM EVEN IN THIS CONFUSION PERCEIVED TO BE BEAUTIFUL HER DARK EYES FULL OF WONDER AND CURIOSITY WERE FIXED ON HIM HER LIPS TREMBLED APART
2893-139310-0003.flac,A PARTIALLY OPENED DOOR GAVE A GLIMPSE OF THE CROWDED HALL AND ADMITTED A VAST UNEVEN TUMULT A HAMMERING CLAPPING AND SHOUTING THAT DIED AWAY AND BEGAN AGAIN AND ROSE TO A THUNDEROUS PITCH
2893-139310-0004.flac,AND SO CONTINUED INTERMITTENTLY ALL THE TIME THAT GRAHAM REMAINED IN THE LITTLE ROOM HE WATCHED THE LIPS OF THE MAN IN BLACK AND GATHERED THAT HE WAS MAKING SOME EXPLANATION HE STARED STUPIDLY FOR SOME MOMENTS AT THESE THINGS AND THEN STOOD UP ABRUPTLY
2893-139310-0005.flac,HE GRASPED THE ARM OF THIS SHOUTING PERSON TELL ME HE CRIED WHO AM I WHO AM I THE OTHERS CAME NEARER TO HEAR HIS WORDS
2893-139310-0006.flac,HIS EYES SEARCHED THEIR FACES THEY HAVE TOLD HIM NOTHING CRIED THE GIRL TELL ME TELL ME CRIED GRAHAM YOU ARE THE MASTER OF THE EARTH YOU ARE OWNER OF THE WORLD
2893-139310-0007.flac,HE DID NOT BELIEVE HE HEARD ARIGHT HE RESISTED THE PERSUASION HE PRETENDED NOT TO UNDERSTAND NOT TO HEAR HE LIFTED HIS VOICE AGAIN I HAVE BEEN AWAKE THREE DAYS A PRISONER THREE DAYS
2893-139310-0008.flac,IT IS LONDON YES SAID THE YOUNGER MAN AND THOSE WHO MEET IN THE GREAT HALL WITH THE WHITE ATLAS HOW DOES IT CONCERN ME
2893-139310-0009.flac,COUNCILLORS UNDER THE ATLAS WHY SHOULD THEY TRY TO DRUG ME TO KEEP YOU INSENSIBLE SAID THE MAN IN YELLOW TO PREVENT YOUR INTERFERENCE
2893-139310-0010.flac,BECAUSE YOU ARE THE ATLAS SIRE SAID THE MAN IN YELLOW THE WORLD IS ON YOUR SHOULDERS THEY RULE IT IN YOUR NAME THE SOUNDS FROM THE HALL HAD DIED INTO A SILENCE
2893-139310-0011.flac,THREADED BY ONE MONOTONOUS VOICE NOW SUDDENLY TRAMPLING ON THESE LAST WORDS CAME A DEAFENING TUMULT A ROARING AND THUNDERING CHEER CROWDED ON CHEER VOICES HOARSE AND SHRILL BEATING OVERLAPPING AND WHILE IT LASTED
2893-139310-0012.flac,THE PEOPLE IN THE LITTLE ROOM COULD NOT HEAR EACH OTHER SHOUT GRAHAM STOOD HIS INTELLIGENCE CLINGING HELPLESSLY TO THE THING HE HAD JUST HEARD THE COUNCIL HE REPEATED BLANKLY AND THEN SNATCHED AT A NAME THAT HAD STRUCK HIM
2893-139310-0013.flac,BUT WHO IS OSTROG HE SAID
2893-139310-0014.flac,OUR LEADER IN YOUR NAME IN MY NAME
2893-139310-0015.flac,WHY IS HE NOT HERE HE HAS DEPUTED US I AM HIS BROTHER HIS HALF BROTHER LINCOLN HE WANTS YOU TO SHOW YOURSELF TO THESE PEOPLE AND THEN COME ON TO HIM THAT IS WHY HE HAS SENT
2893-139310-0016.flac,HE IS AT THE WIND VANE OFFICES DIRECTING THE PEOPLE ARE MARCHING IN YOUR NAME SHOUTED THE YOUNGER MAN THEY HAVE RULED CRUSHED TYRANNISED AT LAST EVEN IN MY NAME MY NAME MASTER
2893-139310-0017.flac,THE YOUNGER MAN SUDDENLY BECAME AUDIBLE IN A PAUSE OF THE OUTER THUNDER
2893-139310-0018.flac,NO ONE EXPECTED YOU TO WAKE THEY WERE CUNNING DAMNED TYRANTS BUT THEY WERE TAKEN BY SURPRISE THEY DID NOT KNOW WHETHER TO DRUG YOU HYPNOTISE YOU KILL YOU AGAIN THE HALL DOMINATED EVERYTHING OSTROG IS AT THE WIND VANE OFFICES READY
2893-139310-0019.flac,EVEN NOW THERE IS A RUMOUR OF FIGHTING BEGINNING THE MAN WHO HAD CALLED HIMSELF LINCOLN CAME CLOSE TO HIM OSTROG HAS IT PLANNED TRUST HIM WE HAVE OUR ORGANISATIONS READY WE SHALL SEIZE THE FLYING STAGES
2893-139310-0020.flac,EVEN NOW HE MAY BE DOING THAT THEN THIS PUBLIC THEATRE BAWLED THE MAN IN YELLOW IS ONLY A CONTINGENT WE HAVE FIVE MYRIADS OF DRILLED MEN WE HAVE ARMS CRIED LINCOLN WE HAVE PLANS A LEADER
2893-139310-0021.flac,MASSED IN THE INAUDIBLE IT IS NOW OR NEVER THE COUNCIL IS ROCKING THEY CANNOT TRUST EVEN THEIR DRILLED MEN HEAR THE PEOPLE CALLING TO YOU GRAHAM'S MIND WAS LIKE A NIGHT OF MOON AND SWIFT CLOUDS
2893-139310-0022.flac,NOW DARK AND HOPELESS NOW CLEAR AND GHASTLY HE WAS MASTER OF THE EARTH HE WAS A MAN SODDEN WITH THAWING SNOW OF ALL HIS FLUCTUATING IMPRESSIONS THE DOMINANT ONES PRESENTED AN ANTAGONISM
2893-139310-0023.flac,ON THE ONE HAND WAS THE WHITE COUNCIL POWERFUL DISCIPLINED FEW
2893-139310-0024.flac,MONSTROUS CROWDS PACKED MASSES OF INDISTINGUISHABLE PEOPLE CLAMOURING HIS NAME HAILING HIM MASTER THE OTHER SIDE HAD IMPRISONED HIM DEBATED HIS DEATH THESE SHOUTING THOUSANDS BEYOND THE LITTLE DOORWAY HAD RESCUED HIM
2893-139310-0025.flac,BUT WHY THESE THINGS SHOULD BE SO HE COULD NOT UNDERSTAND THE DOOR OPENED LINCOLN'S VOICE WAS SWEPT AWAY AND DROWNED AND A RASH OF PEOPLE FOLLOWED ON THE HEELS OF THE TUMULT THESE INTRUDERS CAME TOWARDS HIM
2893-139310-0026.flac,AND LINCOLN GESTICULATING THE VOICES WITHOUT EXPLAINED THEIR SOUNDLESS LIPS SHOW US THE SLEEPER SHOW US THE SLEEPER WAS THE BURDEN OF THE UPROAR MEN WERE BAWLING FOR ORDER SILENCE
2893-139310-0027.flac,A WAVING INCESSANT CONFUSION OF CROWDED SHOUTING FACES MEN AND WOMEN TOGETHER WAVING PALE BLUE GARMENTS EXTENDED HANDS MANY WERE STANDING ONE MAN IN RAGS OF DARK BROWN A GAUNT FIGURE STOOD ON THE SEAT AND WAVED A BLACK CLOTH
2893-139310-0028.flac,HE MET THE WONDER AND EXPECTATION OF THE GIRL'S EYES WHAT DID THESE PEOPLE EXPECT FROM HIM HE WAS DIMLY AWARE THAT THE TUMULT OUTSIDE HAD CHANGED ITS CHARACTER WAS IN SOME WAY BEATING MARCHING HIS OWN MIND TOO CHANGED
2893-139310-0029.flac,BUT A MOMENT THAT WAS NEAR TO PANIC PASSED HE TRIED TO MAKE AUDIBLE INQUIRIES OF
2893-139310-0030.flac,LINCOLN WAS SHOUTING IN HIS EAR BUT GRAHAM WAS DEAFENED TO THAT ALL THE OTHERS SAVE THE WOMAN GESTICULATED TOWARDS THE HALL HE PERCEIVED WHAT HAD HAPPENED TO THE UPROAR THE WHOLE MASS OF PEOPLE WAS CHANTING TOGETHER IT WAS NOT SIMPLY A SONG
2893-139310-0031.flac,THE VOICES WERE GATHERED TOGETHER AND UPBORNE BY A TORRENT OF INSTRUMENTAL MUSIC MUSIC LIKE THE MUSIC OF AN ORGAN
2893-139310-0032.flac,FULL OF FLAUNTING BANNERS FULL OF THE MARCH AND PAGEANTRY OF OPENING WAR AND THE FEET OF THE PEOPLE WERE BEATING TIME TRAMP TRAMP HE WAS URGED TOWARDS THE DOOR HE OBEYED MECHANICALLY
2893-139310-0033.flac,THE STRENGTH OF THAT CHANT TOOK HOLD OF HIM STIRRED HIM EMBOLDENED HIM THE HALL OPENED TO HIM
2893-139310-0034.flac,WAVE YOUR ARM TO THEM SAID LINCOLN WAVE YOUR ARM TO THEM THIS SAID A VOICE ON THE OTHER SIDE HE MUST HAVE THIS ARMS WERE ABOUT HIS NECK DETAINING HIM IN THE DOORWAY AND A BLACK SUBTLY FOLDING MANTLE HUNG FROM HIS SHOULDERS
2893-139310-0035.flac,HE THREW HIS ARM FREE OF THIS AND FOLLOWED LINCOLN HE PERCEIVED THE GIRL IN GREY CLOSE TO HIM HER FACE LIT HER GESTURE ONWARD FOR THE INSTANT SHE BECAME TO HIM FLUSHED AND EAGER AS SHE WAS AN EMBODIMENT OF THE SONG
2893-139310-0036.flac,HE EMERGED IN THE ALCOVE AGAIN INCONTINENTLY THE MOUNTING WAVES OF THE SONG BROKE UPON HIS APPEARING AND FLASHED UP INTO A FOAM OF SHOUTING GUIDED BY LINCOLN'S HAND HE MARCHED OBLIQUELY ACROSS THE CENTRE OF THE STAGE FACING THE PEOPLE
2893-139310-0037.flac,THE HALL WAS A VAST AND INTRICATE SPACE GALLERIES BALCONIES BROAD SPACES OF AMPHITHEATRAL STEPS AND GREAT ARCHWAYS FAR AWAY HIGH UP SEEMED THE MOUTH OF A HUGE PASSAGE FULL OF STRUGGLING HUMANITY
2893-139310-0038.flac,THE WHOLE MULTITUDE WAS SWAYING IN CONGESTED MASSES INDIVIDUAL FIGURES SPRANG OUT OF THE TUMULT IMPRESSED HIM MOMENTARILY AND LOST DEFINITION AGAIN CLOSE TO THE PLATFORM SWAYED A BEAUTIFUL FAIR WOMAN CARRIED BY THREE MEN
2893-139310-0039.flac,HER HAIR ACROSS HER FACE AND BRANDISHING A GREEN STAFF NEXT THIS GROUP AN OLD CAREWORN MAN IN BLUE CANVAS MAINTAINED HIS PLACE IN THE CRUSH WITH DIFFICULTY AND BEHIND SHOUTED A HAIRLESS FACE A GREAT CAVITY OF TOOTHLESS MOUTH A VOICE CALLED
2893-139310-0040.flac,OSTROG ALL HIS IMPRESSIONS WERE VAGUE SAVE THE MASSIVE EMOTION OF THAT TRAMPLING SONG THE MULTITUDE WERE BEATING TIME WITH THEIR FEET MARKING TIME TRAMP TRAMP TRAMP TRAMP THE GREEN WEAPONS WAVED
2893-139310-0041.flac,FLASHED AND SLANTED THEN HE SAW THOSE NEAREST TO HIM ON A LEVEL SPACE BEFORE THE STAGE WERE MARCHING IN FRONT OF HIM PASSING TOWARDS A GREAT ARCHWAY SHOUTING TO THE COUNCIL TRAMP TRAMP TRAMP TRAMP HE RAISED HIS ARM AND THE ROARING WAS REDOUBLED
2893-139310-0042.flac,MARCH HIS MOUTH SHAPED INAUDIBLE HEROIC WORDS HE WAVED HIS ARM AGAIN AND POINTED TO THE ARCHWAY SHOUTING ONWARD THEY WERE NO LONGER MARKING TIME THEY WERE MARCHING TRAMP TRAMP TRAMP TRAMP IN THAT HOST
2893-139310-0043.flac,WERE BEARDED MEN OLD MEN YOUTHS FLUTTERING ROBED BARE ARMED WOMEN GIRLS MEN AND WOMEN OF THE NEW AGE RICH ROBES GREY RAGS FLUTTERED TOGETHER IN THE WHIRL OF THEIR MOVEMENT AMIDST THE DOMINANT BLUE
2893-139310-0044.flac,A MONSTROUS BLACK BANNER JERKED ITS WAY TO THE RIGHT HE PERCEIVED A BLUE CLAD NEGRO A SHRIVELLED WOMAN IN YELLOW THEN A GROUP OF TALL FAIR HAIRED WHITE FACED BLUE CLAD MEN PUSHED THEATRICALLY PAST HIM HE NOTED TWO CHINAMEN
2893-139310-0045.flac,A TALL SALLOW DARK HAIRED SHINING EYED YOUTH WHITE CLAD FROM TOP TO TOE CLAMBERED UP TOWARDS THE PLATFORM SHOUTING LOYALLY AND SPRANG DOWN AGAIN AND RECEDED LOOKING BACKWARD HEADS SHOULDERS
2893-139310-0046.flac,HANDS CLUTCHING WEAPONS ALL WERE SWINGING WITH THOSE MARCHING CADENCES FACES CAME OUT OF THE CONFUSION TO HIM AS HE STOOD THERE EYES MET HIS AND PASSED AND VANISHED MEN GESTICULATED TO HIM SHOUTED INAUDIBLE PERSONAL THINGS
2893-139310-0047.flac,MOST OF THE FACES WERE FLUSHED BUT MANY WERE GHASTLY WHITE AND DISEASE WAS THERE AND MANY A HAND THAT WAVED TO HIM WAS GAUNT AND LEAN MEN AND WOMEN OF THE NEW AGE STRANGE AND INCREDIBLE MEETING AS THE BROAD STREAM PASSED BEFORE HIM TO THE RIGHT
2893-139310-0048.flac,TRIBUTARY GANGWAYS FROM THE REMOTE UPLANDS OF THE HALL THRUST DOWNWARD IN AN INCESSANT REPLACEMENT OF PEOPLE TRAMP TRAMP TRAMP TRAMP THE UNISON OF THE SONG WAS ENRICHED AND COMPLICATED BY THE MASSIVE ECHOES OF ARCHES AND PASSAGES MEN AND WOMEN
2893-139310-0049.flac,MINGLED IN THE RANKS TRAMP TRAMP TRAMP TRAMP THE WHOLE WORLD SEEMED MARCHING TRAMP TRAMP TRAMP TRAMP HIS BRAIN WAS TRAMPING THE GARMENTS WAVED ONWARD THE FACES POURED BY MORE ABUNDANTLY TRAMP TRAMP TRAMP TRAMP
2893-139310-0050.flac,AT LINCOLN'S PRESSURE HE TURNED TOWARDS THE ARCHWAY WALKING UNCONSCIOUSLY IN THAT RHYTHM SCARCELY NOTICING HIS MOVEMENT FOR THE MELODY AND STIR OF IT THE MULTITUDE THE GESTURE AND SONG ALL MOVED IN THAT DIRECTION
2893-139310-0051.flac,THE FLOW OF PEOPLE SMOTE DOWNWARD UNTIL THE UPTURNED FACES WERE BELOW THE LEVEL OF HIS FEET HE WAS AWARE OF A PATH BEFORE HIM OF A SUITE ABOUT HIM OF GUARDS AND DIGNITIES AND LINCOLN ON HIS RIGHT HAND
2893-139310-0052.flac,ATTENDANTS INTERVENED AND EVER AND AGAIN BLOTTED OUT THE SIGHT OF THE MULTITUDE TO THE LEFT BEFORE HIM WENT THE BACKS OF THE GUARDS IN BLACK THREE AND THREE AND THREE HE WAS MARCHED ALONG A LITTLE RAILED WAY AND CROSSED ABOVE THE ARCHWAY
2893-139310-0053.flac,WITH THE TORRENT DIPPING TO FLOW BENEATH AND SHOUTING UP TO HIM HE DID NOT KNOW WHITHER HE WENT HE DID NOT WANT TO KNOW HE GLANCED BACK ACROSS A FLAMING SPACIOUSNESS OF HALL
2893-139322-0000.flac,CHAPTER TWENTY ONE THE UNDER SIDE FROM THE BUSINESS QUARTER THEY PRESENTLY PASSED BY THE RUNNING WAYS INTO A REMOTE QUARTER OF THE CITY WHERE THE BULK OF THE MANUFACTURES WAS DONE
2893-139322-0001.flac,ON THEIR WAY THE PLATFORMS CROSSED THE THAMES TWICE AND PASSED IN A BROAD VIADUCT ACROSS ONE OF THE GREAT ROADS THAT ENTERED THE CITY FROM THE NORTH IN BOTH CASES HIS IMPRESSION WAS SWIFT AND IN BOTH VERY VIVID
2893-139322-0002.flac,THE RIVER WAS A BROAD WRINKLED GLITTER OF BLACK SEA WATER OVERARCHED BY BUILDINGS AND VANISHING EITHER WAY INTO A BLACKNESS STARRED WITH RECEDING LIGHTS A STRING OF BLACK BARGES PASSED SEAWARD MANNED BY BLUE CLAD MEN
2893-139322-0003.flac,THE ROAD WAS A LONG AND VERY BROAD AND HIGH TUNNEL ALONG WHICH BIG WHEELED MACHINES DROVE NOISELESSLY AND SWIFTLY HERE TOO THE DISTINCTIVE BLUE OF THE LABOUR DEPARTMENT WAS IN ABUNDANCE THE SMOOTHNESS OF THE DOUBLE TRACKS
2893-139322-0004.flac,STRUCK GRAHAM MOST VIVIDLY ONE LANK AND VERY HIGH CARRIAGE WITH LONGITUDINAL METALLIC RODS HUNG WITH THE DRIPPING CARCASSES OF MANY HUNDRED SHEEP ARRESTED HIS ATTENTION UNDULY ABRUPTLY THE EDGE OF THE ARCHWAY CUT
2893-139322-0005.flac,AND BLOTTED OUT THE PICTURE PRESENTLY THEY LEFT THE WAY AND DESCENDED BY A LIFT AND TRAVERSED A PASSAGE THAT SLOPED DOWNWARD AND SO CAME TO A DESCENDING LIFT AGAIN THE APPEARANCE OF THINGS CHANGED EVEN THE PRETENCE OF ARCHITECTURAL ORNAMENT DISAPPEARED
2893-139322-0006.flac,THE LIGHTS DIMINISHED IN NUMBER AND SIZE THE ARCHITECTURE BECAME MORE AND MORE MASSIVE IN PROPORTION TO THE SPACES AS THE FACTORY QUARTERS WERE REACHED AND IN THE DUSTY BISCUIT MAKING PLACE OF THE POTTERS AMONG THE FELSPAR MILLS IN THE FURNACE ROOMS OF THE METAL WORKERS
2893-139322-0007.flac,THE BLUE CANVAS CLOTHING WAS ON MAN WOMAN AND CHILD MANY OF THESE GREAT AND DUSTY GALLERIES WERE SILENT AVENUES OF MACHINERY ENDLESS RAKED OUT ASHEN FURNACES TESTIFIED TO THE REVOLUTIONARY DISLOCATION
2893-139322-0008.flac,BUT WHEREVER THERE WAS WORK IT WAS BEING DONE BY SLOW MOVING WORKERS IN BLUE CANVAS THE ONLY PEOPLE NOT IN BLUE CANVAS WERE THE OVERLOOKERS OF THE WORK PLACES AND THE ORANGE CLAD LABOUR POLICE AND FRESH FROM THE FLUSHED FACES OF THE DANCING HALLS
2893-139322-0009.flac,THE VOLUNTARY VIGOURS OF THE BUSINESS QUARTER GRAHAM COULD NOTE THE PINCHED FACES THE FEEBLE MUSCLES AND WEARY EYES OF MANY OF THE LATTER DAY WORKERS SUCH AS HE SAW AT WORK WERE NOTICEABLY INFERIOR IN PHYSIQUE TO THE FEW GAILY DRESSED MANAGERS AND FOREWOMEN
2893-139322-0010.flac,WHO WERE DIRECTING THEIR LABOURS THE BURLY LABOURERS OF THE OLD VICTORIAN TIMES HAD FOLLOWED THAT DRAY HORSE AND ALL SUCH LIVING FORCE PRODUCERS TO EXTINCTION THE PLACE OF HIS COSTLY MUSCLES WAS TAKEN BY SOME DEXTEROUS MACHINE
2893-139322-0011.flac,THE LATTER DAY LABOURER MALE AS WELL AS FEMALE WAS ESSENTIALLY A MACHINE MINDER AND FEEDER A SERVANT AND ATTENDANT OR AN ARTIST UNDER DIRECTION THE WOMEN IN COMPARISON WITH THOSE GRAHAM REMEMBERED
2893-139322-0012.flac,WERE AS A CLASS DISTINCTLY PLAIN AND FLAT CHESTED TWO HUNDRED YEARS OF EMANCIPATION FROM THE MORAL RESTRAINTS OF PURITANICAL RELIGION TWO HUNDRED YEARS OF CITY LIFE HAD DONE THEIR WORK IN ELIMINATING THE STRAIN OF FEMININE BEAUTY AND VIGOUR FROM THE BLUE CANVAS MYRIADS
2893-139322-0013.flac,TO BE BRILLIANT PHYSICALLY OR MENTALLY TO BE IN ANY WAY ATTRACTIVE OR EXCEPTIONAL HAD BEEN AND WAS STILL A CERTAIN WAY OF EMANCIPATION TO THE DRUDGE A LINE OF ESCAPE TO THE PLEASURE CITY AND ITS SPLENDOURS AND DELIGHTS AND AT LAST
2893-139322-0014.flac,TO THE EUTHANASY AND PEACE TO BE STEADFAST AGAINST SUCH INDUCEMENTS WAS SCARCELY TO BE EXPECTED OF MEANLY NOURISHED SOULS IN THE YOUNG CITIES OF GRAHAM'S FORMER LIFE THE NEWLY AGGREGATED LABOURING MASS
2893-139322-0015.flac,HAD BEEN A DIVERSE MULTITUDE STILL STIRRED BY THE TRADITION OF PERSONAL HONOUR AND A HIGH MORALITY NOW IT WAS DIFFERENTIATING INTO AN INSTINCT CLASS WITH A MORAL AND PHYSICAL DIFFERENCE OF ITS OWN EVEN WITH A DIALECT OF ITS OWN
2893-139322-0016.flac,THEY PENETRATED DOWNWARD EVER DOWNWARD TOWARDS THE WORKING PLACES PRESENTLY THEY PASSED UNDERNEATH ONE OF THE STREETS OF THE MOVING WAYS AND SAW ITS PLATFORMS RUNNING ON THEIR RAILS FAR OVERHEAD AND CHINKS OF WHITE LIGHTS BETWEEN THE TRANSVERSE SLITS
2893-139322-0017.flac,THE FACTORIES THAT WERE NOT WORKING WERE SPARSELY LIGHTED TO GRAHAM THEY AND THEIR SHROUDED AISLES OF GIANT MACHINES SEEMED PLUNGED IN GLOOM AND EVEN WHERE WORK WAS GOING ON THE ILLUMINATION WAS FAR LESS BRILLIANT THAN UPON THE PUBLIC WAYS
2893-139322-0018.flac,HE CAME TO THE WARREN OF THE JEWELLERS AND WITH SOME DIFFICULTY AND BY USING HIS SIGNATURE OBTAINED ADMISSION TO THESE GALLERIES THEY WERE HIGH AND DARK AND RATHER COLD IN THE FIRST A FEW MEN WERE MAKING ORNAMENTS OF GOLD FILIGREE
2893-139322-0019.flac,EACH MAN AT A LITTLE BENCH BY HIMSELF AND WITH A LITTLE SHADED LIGHT THE LONG VISTA OF LIGHT PATCHES WITH THE NIMBLE FINGERS BRIGHTLY LIT AND MOVING AMONG THE GLEAMING YELLOW COILS AND THE INTENT FACE LIKE THE FACE OF A GHOST IN EACH SHADOW
2893-139322-0020.flac,HAD THE ODDEST EFFECT THE WORK WAS BEAUTIFULLY EXECUTED
2893-139322-0021.flac,FOR THE MOST PART INTRICATE GROTESQUES OR THE RINGING OF THE CHANGES ON A GEOMETRICAL MOTIF THESE WORKERS WORE A PECULIAR WHITE UNIFORM WITHOUT POCKETS OR SLEEVES THEY ASSUMED THIS ON COMING TO WORK BUT AT NIGHT
2893-139322-0022.flac,IN SPITE OF EVERY PRECAUTION THE LABOUR POLICEMAN TOLD THEM IN A DEPRESSED TONE THE DEPARTMENT WAS NOT INFREQUENTLY ROBBED BEYOND WAS A GALLERY OF WOMEN BUSIED IN CUTTING AND SETTING SLABS OF ARTIFICIAL RUBY
2893-139322-0023.flac,MANY OF THESE WORKERS HAD LIPS AND NOSTRILS A LIVID WHITE DUE TO A DISEASE CAUSED BY A PECULIAR PURPLE ENAMEL THAT CHANCED TO BE MUCH IN FASHION ASANO APOLOGISED TO GRAHAM FOR THIS OFFENSIVE SIGHT BUT EXCUSED HIMSELF ON THE SCORE OF THE CONVENIENCE OF THIS ROUTE
2893-139322-0024.flac,THIS IS WHAT I WANTED TO SEE SAID GRAHAM THIS IS WHAT I WANTED TO SEE TRYING TO AVOID A START AT A PARTICULARLY STRIKING DISFIGUREMENT SHE MIGHT HAVE DONE BETTER WITH HERSELF THAN THAT SAID ASANO
2893-139322-0025.flac,GRAHAM MADE SOME INDIGNANT COMMENTS BUT SIRE WE SIMPLY COULD NOT STAND THAT STUFF WITHOUT THE PURPLE SAID ASANO IN YOUR DAYS PEOPLE COULD STAND SUCH CRUDITIES THEY WERE NEARER THE BARBARIC BY TWO HUNDRED YEARS
2893-139322-0026.flac,AND CAME TO A LITTLE BRIDGE THAT SPANNED A VAULT LOOKING OVER THE PARAPET GRAHAM SAW THAT BENEATH WAS A WHARF UNDER YET MORE TREMENDOUS ARCHINGS THAN ANY HE HAD SEEN THREE BARGES SMOTHERED IN FLOURY DUST WERE BEING UNLOADED OF THEIR CARGOES OF POWDERED FELSPAR
2893-139322-0027.flac,BY A MULTITUDE OF COUGHING MEN EACH GUIDING A LITTLE TRUCK THE DUST FILLED THE PLACE WITH A CHOKING MIST AND TURNED THE ELECTRIC GLARE YELLOW THE VAGUE SHADOWS OF THESE WORKERS GESTICULATED ABOUT THEIR FEET AND RUSHED TO AND FRO AGAINST A LONG STRETCH OF WHITE WASHED WALL
2893-139322-0028.flac,EVERY NOW AND THEN ONE WOULD STOP TO COUGH A SHADOWY HUGE MASS OF MASONRY RISING OUT OF THE INKY WATER BROUGHT TO GRAHAM'S MIND THE THOUGHT OF THE MULTITUDE OF WAYS AND GALLERIES AND LIFTS THAT ROSE FLOOR ABOVE FLOOR OVERHEAD BETWEEN HIM AND THE SKY
2893-139322-0029.flac,THEIR FEET MADE A HOLLOW THUNDER ON THE PLANKS ALONG WHICH THEY WENT TO AND FRO AND AS HE LOOKED AT THIS SCENE SOME HIDDEN VOICE IN THE DARKNESS BEGAN TO SING STOP THAT SHOUTED ONE OF THE POLICEMEN BUT THE ORDER WAS DISOBEYED
2893-139322-0030.flac,AND FIRST ONE AND THEN ALL THE WHITE STAINED MEN WHO WERE WORKING THERE HAD TAKEN UP THE BEATING REFRAIN SINGING IT DEFIANTLY THE SONG OF THE REVOLT THE FEET UPON THE PLANKS THUNDERED NOW TO THE RHYTHM OF THE SONG TRAMP TRAMP TRAMP
