audio,text
669-129061-0050.flac,WERE THRONGED WITH PEOPLE OUT UPON THEIR SUNDAY PLEASURE BUT THE COLONEL WAS MUCH TOO BUSY TO TAKE ANY HEED OF THESE PHENOMENA AND ARRIVING AT KNIGHTSBRIDGE
669-129061-0051.flac,SPEEDILY MADE HIS WAY UP TO THE ROOM OF HIS OLD FRIEND AND COMRADE CAPTAIN MACMURDO WHO CRAWLEY FOUND TO HIS SATISFACTION WAS IN BARRACKS CAPTAIN MACMURDO
669-129061-0052.flac,A VETERAN OFFICER AND WATERLOO MAN GREATLY LIKED BY HIS REGIMENT IN WHICH WANT OF MONEY ALONE PREVENTED HIM FROM ATTAINING THE HIGHEST RANKS WAS ENJOYING THE FORENOON CALMLY IN BED
669-129061-0053.flac,AND A NUMBER OF LADIES OF THE CORPS DE BALLET AND OLD MAC WHO WAS AT HOME WITH PEOPLE OF ALL AGES AND RANKS AND CONSORTED WITH GENERALS DOG FANCIERS OPERA DANCERS BRUISERS
669-129061-0054.flac,AND EVERY KIND OF PERSON IN A WORD WAS RESTING HIMSELF AFTER THE NIGHT'S LABOURS AND NOT BEING ON DUTY WAS IN BED HIS ROOM WAS HUNG ROUND WITH BOXING SPORTING AND DANCING PICTURES
669-129061-0055.flac,HE HAD A SINGULAR MUSEUM HE WAS ONE OF THE BEST SHOTS IN ENGLAND AND FOR A HEAVY MAN ONE OF THE BEST RIDERS INDEED HE AND CRAWLEY
669-129061-0056.flac,AND THE BARKING BUTCHER WHICH HAS BEEN BEFORE MENTIONED A VENERABLE BRISTLY WARRIOR WITH A LITTLE CLOSE SHAVED GREY HEAD WITH A SILK NIGHTCAP A RED FACE AND NOSE AND A GREAT
669-129061-0057.flac,DYED MOUSTACHE WHEN RAWDON TOLD THE CAPTAIN HE WANTED A FRIEND THE LATTER KNEW PERFECTLY WELL ON WHAT DUTY OF FRIENDSHIP HE WAS CALLED TO ACT AND INDEED HAD CONDUCTED SCORES OF AFFAIRS
669-129061-0058.flac,FOR HIS ACQUAINTANCES WITH THE GREATEST PRUDENCE AND SKILL HIS ROYAL HIGHNESS THE LATE LAMENTED COMMANDER IN CHIEF HAD HAD THE GREATEST REGARD FOR MACMURDO ON THIS ACCOUNT
669-129061-0059.flac,CAPTAIN MARKER IT'S ABOUT ABOUT MY WIFE CRAWLEY ANSWERED CASTING DOWN HIS EYES AND TURNING VERY RED THE OTHER GAVE A WHISTLE
669-129061-0060.flac,I ALWAYS SAID SHE'D THROW YOU OVER HE BEGAN INDEED THERE WERE BETS IN THE REGIMENT AND AT THE CLUBS REGARDING THE PROBABLE FATE OF COLONEL CRAWLEY
669-129061-0061.flac,THINK OF HIS ONLY FINDING HER OUT NOW THE CAPTAIN THOUGHT TO HIMSELF AND REMEMBERED A HUNDRED PARTICULAR CONVERSATIONS AT THE MESS TABLE IN WHICH MISSUS CRAWLEY'S REPUTATION
669-129061-0062.flac,HAD BEEN TORN TO SHREDS THERE'S NO WAY BUT ONE OUT OF IT
669-129061-0063.flac,AND THERE'S ONLY A WAY OUT OF IT FOR ONE OF US MAC DO YOU UNDERSTAND I WAS PUT OUT OF THE WAY ARRESTED I FOUND EM ALONE TOGETHER
669-129061-0064.flac,I TOLD HIM HE WAS A LIAR AND A COWARD AND KNOCKED HIM DOWN AND THRASHED HIM SERVE HIM RIGHT MACMURDO SAID WHO IS IT RAWDON ANSWERED IT WAS LORD STEYNE
669-129061-0065.flac,THE DEUCE A MARQUIS THEY SAID HE THAT IS THEY SAID YOU WHAT THE DEVIL DO YOU MEAN ROARED OUT RAWDON DO YOU MEAN THAT YOU EVER HEARD A FELLOW DOUBT ABOUT MY WIFE
669-129061-0066.flac,IT WAS DAMNED UNFRIENDLY MAC SAID RAWDON QUITE OVERCOME AND COVERING HIS FACE WITH HIS HANDS HE GAVE WAY TO AN EMOTION THE SIGHT OF WHICH CAUSED THE TOUGH OLD CAMPAIGNER
669-129061-0067.flac,I GAVE UP EVERYTHING I HAD TO HER I'M A BEGGAR BECAUSE I WOULD MARRY HER BY JOVE SIR I'VE PAWNED MY OWN WATCH IN ORDER TO GET HER ANYTHING SHE FANCIED AND SHE
669-129061-0068.flac,SHE'S BEEN MAKING A PURSE FOR HERSELF ALL THE TIME AND GRUDGED ME A HUNDRED POUND TO GET ME OUT OF QUOD HE THEN FIERCELY AND INCOHERENTLY AND WITH AN AGITATION
669-129061-0069.flac,UNDER WHICH HIS COUNSELLOR HAD NEVER BEFORE SEEN HIM LABOUR TOLD MACMURDO THE CIRCUMSTANCES OF THE STORY HIS ADVISER CAUGHT AT SOME STRAY HINTS IN IT
669-129061-0070.flac,SHE MAY BE INNOCENT AFTER ALL HE SAID SHE SAYS SO
669-129061-0071.flac,THIS IS WHAT HE GAVE HER MAC AND SHE KEP IT UNKNOWN TO ME AND WITH THIS MONEY IN THE HOUSE SHE REFUSED TO STAND BY ME WHEN I WAS LOCKED UP
669-129061-0072.flac,RAWDON DISPATCHED CAPTAIN MACMURDO'S SERVANT TO CURZON STREET WITH AN ORDER TO THE DOMESTIC THERE TO GIVE UP A BAG OF CLOTHES OF WHICH THE COLONEL HAD GREAT NEED AND DURING THE MAN'S ABSENCE
669-129061-0073.flac,CAPTAIN MACMURDO HAD THE HONOUR OF WAITING UPON THE MARQUIS OF STEYNE ON THE PART OF COLONEL RAWDON CRAWLEY AND BEGGED TO INTIMATE THAT HE WAS EMPOWERED BY THE COLONEL
669-129061-0074.flac,TO MAKE ANY ARRANGEMENTS FOR THE MEETING WHICH HE HAD NO DOUBT IT WAS HIS LORDSHIP'S INTENTION TO DEMAND AND WHICH THE CIRCUMSTANCES OF THE MORNING HAD RENDERED INEVITABLE
669-129061-0075.flac,IN THE MOST POLITE MANNER TO APPOINT A FRIEND WITH WHOM HE CAPTAIN M M MIGHT COMMUNICATE AND DESIRED THAT THE MEETING MIGHT TAKE PLACE WITH AS LITTLE DELAY AS POSSIBLE
669-129061-0076.flac,IN CURZON STREET BUT WITHOUT THE CARPET BAG AND PORTMANTEAU FOR WHICH HE HAD BEEN SENT AND WITH A VERY PUZZLED AND ODD FACE THEY WON'T GIVE EM UP
669-129061-0077.flac,SAID THE MAN THERE'S A REGULAR SHINTY IN THE HOUSE AND EVERYTHING AT SIXES AND SEVENS THE LANDLORD'S COME IN AND TOOK POSSESSION THE SERVANTS WAS A DRINKIN UP IN THE DRAWINGROOM THEY SAID
669-129061-0078.flac,THE MAN ADDED AFTER A PAUSE ONE OF THE SERVANTS IS OFF ALREADY
669-129061-0079.flac,THE MAN AS WAS VERY NOISY AND DRUNK INDEED SAYS NOTHING SHALL GO OUT OF THE HOUSE UNTIL HIS WAGES IS PAID UP THE ACCOUNT OF THIS LITTLE REVOLUTION IN MAY FAIR ASTONISHED
669-129061-0080.flac,BUT ABOUT GOING HOME NEXT SATURDAY WHEN HIS FATHER WOULD CERTAINLY TIP HIM AND PERHAPS WOULD TAKE HIM TO THE PLAY HE'S A REGULAR TRUMP THAT BOY THE FATHER WENT ON STILL MUSING ABOUT HIS SON
669-129061-0081.flac,I SAY MAC IF ANYTHING GOES WRONG IF I DROP I SHOULD LIKE YOU TO TO GO AND SEE HIM YOU KNOW AND SAY THAT I WAS VERY FOND OF HIM AND THAT
669-129061-0082.flac,MISTER MACMURDO HAD ALSO OCCASION TO TAKE OFF HIS SILK NIGHT CAP AND RUB IT ACROSS HIS EYES GO DOWN AND ORDER SOME BREAKFAST HE SAID TO HIS MAN IN A LOUD CHEERFUL VOICE WHAT'LL YOU HAVE CRAWLEY
669-129061-0083.flac,LET'S SAY AND CLAY LAY OUT SOME DRESSING THINGS FOR THE COLONEL WE WERE ALWAYS PRETTY MUCH OF A SIZE RAWDON MY BOY AND NEITHER OF US RIDE SO LIGHT AS WE DID WHEN WE FIRST ENTERED THE CORPS
669-129061-0084.flac,WITH WHICH AND LEAVING THE COLONEL TO DRESS HIMSELF MACMURDO TURNED ROUND TOWARDS THE WALL AND RESUMED THE PERUSAL OF BELL'S LIFE UNTIL SUCH TIME AS HIS FRIEND'S TOILETTE WAS COMPLETE
669-129061-0085.flac,HE WAXED HIS MUSTACHIOS INTO A STATE OF BRILLIANT POLISH AND PUT ON A TIGHT CRAVAT AND A TRIM BUFF WAISTCOAT SO THAT ALL THE YOUNG OFFICERS IN THE MESS ROOM WHITHER CRAWLEY HAD PRECEDED HIS FRIEND
6880-216547-0000.flac,THE FOLLOWING LETTER SERVED AS A PREFACE TO THE FIRST EDITION OF THIS MEMOIR
6880-216547-0001.flac,PARIS JUNE THIRTIETH EIGHTEEN FORTY GENTLEMEN IN THE COURSE OF YOUR DEBATE OF THE NINTH OF MAY EIGHTEEN THIRTY THREE IN REGARD TO THE TRIENNIAL PENSION ESTABLISHED BY MADAME SUARD
6880-216547-0002.flac,YOU EXPRESSED THE FOLLOWING WISH THE ACADEMY REQUESTS THE TITULARY TO PRESENT IT ANNUALLY DURING THE FIRST FORTNIGHT IN JULY WITH A SUCCINCT AND LOGICAL STATEMENT OF THE VARIOUS STUDIES WHICH HE HAS PURSUED DURING THE YEAR
6880-216547-0003.flac,WHICH HAS JUST EXPIRED I NOW PROPOSE GENTLEMEN TO DISCHARGE THIS DUTY
6880-216547-0004.flac,WHEN I SOLICITED YOUR VOTES I BOLDLY AVOWED MY INTENTION TO BEND MY EFFORTS TO THE DISCOVERY OF SOME MEANS OF AMELIORATING THE PHYSICAL
6880-216547-0005.flac,MORAL AND INTELLECTUAL CONDITION OF THE MERE NUMEROUS AND POORER CLASSES THIS IDEA FOREIGN AS IT MAY HAVE SEEMED TO THE OBJECT OF MY CANDIDACY YOU RECEIVED FAVORABLY
6880-216547-0006.flac,YOU CHANGED THIS FORMAL OFFER INTO AN INVIOLABLE AND SACRED OBLIGATION THENCEFORTH I UNDERSTOOD WITH HOW WORTHY AND HONORABLE A SOCIETY I HAD TO DEAL MY REGARD FOR ITS ENLIGHTENMENT MY RECOGNITION OF ITS BENEFITS
6880-216547-0007.flac,MY ENTHUSIASM FOR ITS GLORY WERE UNBOUNDED CONVINCED AT ONCE THAT IN ORDER TO BREAK LOOSE FROM THE BEATEN PATHS OF OPINIONS AND SYSTEMS IT WAS NECESSARY TO PROCEED IN MY STUDY OF MAN AND SOCIETY
6880-216547-0008.flac,BY SCIENTIFIC METHODS AND IN A RIGOROUS MANNER I DEVOTED ONE YEAR TO PHILOLOGY AND GRAMMAR LINGUISTICS OR THE NATURAL HISTORY OF SPEECH BEING OF ALL THE SCIENCES THAT
6880-216547-0009.flac,SEEMED TO BEAR THE CLOSEST RELATION TO THE RESEARCHES WHICH I WAS ABOUT TO COMMENCE
6880-216547-0010.flac,IF IT DID NOT REVEAL THE ASTONISHING SUCCESS AT LEAST BORE WITNESS TO THE THOROUGHNESS OF MY LABORS SINCE THAT TIME METAPHYSICS AND MORAL SCIENCE HAVE BEEN MY ONLY STUDIES
6880-216547-0011.flac,MY PERCEPTION OF THE FACT THAT THESE SCIENCES THOUGH BADLY DEFINED AS TO THEIR OBJECT AND NOT CONFINED TO THEIR SPHERE ARE LIKE THE NATURAL SCIENCES SUSCEPTIBLE OF DEMONSTRATION AND CERTAINTY
6880-216547-0012.flac,HAS ALREADY REWARDED MY EFFORTS BUT GENTLEMEN OF ALL THE MASTERS WHOM I HAVE FOLLOWED TO NONE DO I OWE SO MUCH AS TO YOU
6880-216547-0013.flac,YOUR CO OPERATION YOUR PROGRAMMES YOUR INSTRUCTIONS IN AGREEMENT WITH MY SECRET WISHES AND MOST CHERISHED HOPES HAVE AT NO TIME FAILED TO ENLIGHTEN ME AND TO POINT OUT MY ROAD THIS MEMOIR ON PROPERTY
6880-216547-0014.flac,IS THE CHILD OF YOUR THOUGHT
6880-216547-0015.flac,TO WHAT CAUSES MUST WE ATTRIBUTE THE CONTINUALLY INCREASING NUMBER OF SUICIDES AND WHAT ARE THE PROPER MEANS FOR ARRESTING THE EFFECTS OF THIS MORAL CONTAGION
6880-216547-0016.flac,THEREBY IT ASKED IN LESS GENERAL TERMS WHAT WAS THE CAUSE OF THE SOCIAL EVIL AND WHAT WAS ITS REMEDY YOU ADMITTED THAT YOURSELVES GENTLEMEN
6880-216547-0017.flac,WHEN YOUR COMMITTEE REPORTED THAT THE COMPETITORS HAD ENUMERATED WITH EXACTNESS THE IMMEDIATE AND PARTICULAR CAUSES OF SUICIDE AS WELL AS THE MEANS OF PREVENTING EACH OF THEM BUT THAT FROM THIS ENUMERATION
6880-216547-0018.flac,CHRONICLED WITH MORE OR LESS SKILL NO POSITIVE INFORMATION HAD BEEN GAINED EITHER AS TO THE PRIMARY CAUSE OF THE EVIL OR AS TO ITS REMEDY IN EIGHTEEN THIRTY NINE
6880-216547-0019.flac,YOUR PROGRAMME ALWAYS ORIGINAL AND VARIED IN ITS ACADEMICAL EXPRESSION BECAME MORE EXACT THE INVESTIGATIONS OF EIGHTEEN THIRTY EIGHT HAD POINTED OUT AS THE CAUSES OR RATHER AS THE SYMPTOMS OF THE SOCIAL MALADY
6880-216547-0020.flac,THE NEGLECT OF THE PRINCIPLES OF RELIGION AND MORALITY THE DESIRE FOR WEALTH THE PASSION FOR ENJOYMENT AND POLITICAL DISTURBANCES ALL THESE DATA WERE EMBODIED BY YOU IN A SINGLE PROPOSITION
6880-216547-0021.flac,THE UTILITY OF THE CELEBRATION OF SUNDAY AS REGARDS HYGIENE MORALITY AND SOCIAL AND POLITICAL RELATION IN A CHRISTIAN TONGUE YOU ASKED GENTLEMEN
6880-216547-0022.flac,WHAT WAS THE TRUE SYSTEM OF SOCIETY A COMPETITOR
6880-216547-0023.flac,DARED TO MAINTAIN AND BELIEVED THAT HE HAD PROVED THAT THE INSTITUTION OF A DAY OF REST AT WEEKLY INTERVALS IS INSEPARABLY BOUND UP WITH A POLITICAL SYSTEM BASED ON THE EQUALITY OF CONDITIONS
6880-216547-0024.flac,THAT WITHOUT EQUALITY THIS INSTITUTION IS AN ANOMALY AND AN IMPOSSIBILITY THAT EQUALITY ALONE CAN REVIVE THIS ANCIENT AND MYSTERIOUS KEEPING OF THE SEVENTH DAY
6880-216547-0025.flac,THIS ARGUMENT DID NOT MEET WITH YOUR APPROBATION SINCE WITHOUT DENYING THE RELATION POINTED OUT BY THE COMPETITOR YOU JUDGED AND RIGHTLY GENTLEMEN
6880-216547-0026.flac,THAT THE PRINCIPLE OF EQUALITY OF CONDITIONS NOT BEING DEMONSTRATED THE IDEAS OF THE AUTHOR WERE NOTHING MORE THAN HYPOTHESES FINALLY GENTLEMEN
6880-216547-0027.flac,THIS FUNDAMENTAL PRINCIPLE OF EQUALITY YOU PRESENTED FOR COMPETITION IN THE FOLLOWING TERMS
6880-216547-0028.flac,THE ECONOMICAL AND MORAL CONSEQUENCES IN FRANCE UP TO THE PRESENT TIME AND THOSE WHICH SEEM LIKELY TO APPEAR IN FUTURE OF THE LAW CONCERNING THE EQUAL DIVISION OF HEREDITARY PROPERTY BETWEEN THE CHILDREN
6880-216547-0029.flac,INSTEAD OF CONFINING ONE TO COMMON PLACES WITHOUT BREADTH OR SIGNIFICANCE IT SEEMS TO ME THAT YOUR QUESTION SHOULD BE DEVELOPED AS FOLLOWS
6880-216547-0030.flac,CAN IT NOT RENDER IT EQUAL FOR ALL HIS GRANDCHILDREN AND GREAT GRANDCHILDREN IF THE LAW NO LONGER HEEDS THE AGE OF ANY MEMBER OF THE FAMILY CAN IT NOT BY THE RIGHT OF HEREDITY
6880-216547-0031.flac,CEASE TO HEED IT IN THE RACE IN THE TRIBE IN THE NATION CAN EQUALITY BY THE RIGHT OF SUCCESSION BE PRESERVED BETWEEN CITIZENS AS WELL AS BETWEEN COUSINS AND BROTHERS
6880-216547-0032.flac,IN A WORD CAN THE PRINCIPLE OF SUCCESSION BECOME A PRINCIPLE OF EQUALITY TO SUM UP ALL THESE IDEAS IN ONE INCLUSIVE QUESTION WHAT IS THE PRINCIPLE OF HEREDITY
6880-216547-0033.flac,WHAT ARE THE FOUNDATIONS OF INEQUALITY WHAT IS PROPERTY SUCH GENTLEMEN IS THE OBJECT OF THE MEMOIR THAT I OFFER YOU TO DAY
6880-216547-0034.flac,IF I HAVE RIGHTLY GRASPED THE OBJECT OF YOUR THOUGHT IF I SUCCEED IN BRINGING TO LIGHT A TRUTH WHICH IS INDISPUTABLE BUT FROM CAUSES WHICH I AM BOLD ENOUGH TO CLAIM TO HAVE EXPLAINED
6880-216547-0035.flac,HAS ALWAYS BEEN MISUNDERSTOOD IF BY AN INFALLIBLE METHOD OF INVESTIGATION I ESTABLISH THE DOGMA OF EQUALITY OF CONDITIONS IF I DETERMINE THE PRINCIPLE OF CIVIL LAW THE ESSENCE OF JUSTICE AND THE FORM OF SOCIETY
6880-216547-0036.flac,TO YOU GENTLEMEN WILL REDOUND ALL THE GLORY FOR IT IS TO YOUR AID AND YOUR INSPIRATION THAT I OWE IT MY PURPOSE IN THIS WORK IS THE APPLICATION OF METHOD
6880-216547-0037.flac,TO THE PROBLEMS OF PHILOSOPHY EVERY OTHER INTENTION IS FOREIGN TO AND EVEN ABUSIVE OF IT I HAVE SPOKEN LIGHTLY OF JURISPRUDENCE I HAD THE RIGHT
6880-216547-0038.flac,BUT I SHOULD BE UNJUST DID I NOT DISTINGUISH BETWEEN THIS PRETENDED SCIENCE AND THE MEN WHO PRACTISE IT DEVOTED TO STUDIES BOTH LABORIOUS AND SEVERE
6880-216547-0039.flac,ENTITLED IN ALL RESPECTS TO THE ESTEEM OF THEIR FELLOW CITIZENS BY THEIR KNOWLEDGE AND ELOQUENCE OUR LEGISTS DESERVE BUT ONE REPROACH THAT OF AN EXCESSIVE DEFERENCE TO ARBITRARY LAWS
6880-216547-0040.flac,AND THEIR UNWARRANTED BLUNDERS HAVE DISGUSTED ME WHOEVER KNOWING THEM PARDONS THEM MAY READ THEM I HAVE SEVERELY BLAMED THE LEARNED CHRISTIAN CHURCH
6880-216547-0041.flac,IT WAS MY DUTY THIS BLAME RESULTS FROM THE FACTS WHICH I CALL ATTENTION TO WHY HAS THE CHURCH DECREED CONCERNING THINGS WHICH IT DOES NOT UNDERSTAND
6880-216547-0042.flac,THE CHURCH HAS ERRED IN DOGMA AND IN MORALS PHYSICS AND MATHEMATICS TESTIFY AGAINST HER IT MAY BE WRONG FOR ME TO SAY IT BUT SURELY IT IS UNFORTUNATE FOR CHRISTIANITY THAT IT IS TRUE
6880-216547-0043.flac,TO RESTORE RELIGION GENTLEMEN IT IS NECESSARY TO CONDEMN THE CHURCH PERHAPS YOU WILL REGRET GENTLEMEN THAT IN GIVING ALL MY ATTENTION TO METHOD AND EVIDENCE
6880-216547-0044.flac,I HAVE TOO MUCH NEGLECTED FORM AND STYLE IN VAIN SHOULD I HAVE TRIED TO DO BETTER LITERARY HOPE AND FAITH I HAVE NONE
6880-216547-0045.flac,THAT IS THE REASON IN MY OPINION WHY AMONG SO MANY MEN OF TALENT FRANCE TO DAY COUNTS NOT ONE GREAT WRITER
6880-216547-0046.flac,IN A SOCIETY LIKE OURS TO SEEK FOR LITERARY GLORY SEEMS TO ME AN ANACHRONISM OF WHAT USE IS IT TO INVOKE AN ANCIENT SIBYL WHEN A MUSE IS ON THE EVE OF BIRTH
6880-216547-0047.flac,PITIABLE ACTORS IN A TRAGEDY NEARING ITS END THAT WHICH IT BEHOOVES US TO DO IS TO PRECIPITATE THE CATASTROPHE THE MOST DESERVING AMONG US IS HE WHO PLAYS BEST THIS PART WELL
6880-216547-0048.flac,I NO LONGER ASPIRE TO THIS SAD SUCCESS WHY SHOULD I NOT CONFESS IT GENTLEMEN I HAVE ASPIRED TO YOUR SUFFRAGES AND SOUGHT THE TITLE OF YOUR PENSIONER HATING ALL WHICH EXISTS AND FULL OF PROJECTS FOR ITS DESTRUCTION
6880-216547-0049.flac,AND THE MOST PRECIOUS FRUIT THAT I COULD WISH TO GATHER FROM THIS MEMOIR WOULD BE THE INSPIRATION OF MY READERS WITH THAT TRANQUILLITY OF SOUL WHICH ARISES FROM THE CLEAR PERCEPTION OF EVIL AND ITS CAUSE
6880-216547-0050.flac,AND WHICH IS MUCH MORE POWERFUL THAN PASSION AND ENTHUSIASM MY HATRED OF PRIVILEGE AND HUMAN AUTHORITY WAS UNBOUNDED PERHAPS AT TIMES I HAVE BEEN GUILTY IN MY INDIGNATION
6880-216547-0051.flac,OF CONFOUNDING PERSONS AND THINGS AT PRESENT I CAN ONLY DESPISE AND COMPLAIN TO CEASE TO HATE I ONLY NEEDED TO KNOW
6880-216547-0052.flac,IT IS FOR YOU NOW GENTLEMEN WHOSE MISSION AND CHARACTER ARE THE PROCLAMATION OF THE TRUTH IT IS FOR YOU TO INSTRUCT THE PEOPLE AND TO TELL THEM FOR WHAT THEY OUGHT TO HOPE
6880-216547-0053.flac,AND WHAT THEY OUGHT TO FEAR THE PEOPLE INCAPABLE AS YET OF SOUND JUDGMENT AS TO WHAT IS BEST FOR THEM APPLAUD INDISCRIMINATELY THE MOST OPPOSITE IDEAS PROVIDED THAT IN THEM THEY GET A TASTE OF FLATTERY
6880-216547-0054.flac,TO THEM THE LAWS OF THOUGHT ARE LIKE THE CONFINES OF THE POSSIBLE TO DAY THEY CAN NO MORE DISTINGUISH BETWEEN A SAVANT AND A SOPHIST THAN FORMERLY THEY COULD TELL A PHYSICIAN FROM A SORCERER
6880-216547-0055.flac,INCONSIDERATELY ACCEPTING GATHERING TOGETHER AND ACCUMULATING EVERYTHING THAT IS NEW REGARDING ALL REPORTS AS TRUE
6880-216547-0056.flac,THEY ASSEMBLE LIKE BEES AT THE SOUND OF A BASIN
6880-216547-0057.flac,MAY YOU GENTLEMEN DESIRE EQUALITY AS I MYSELF DESIRE IT MAY YOU FOR THE ETERNAL HAPPINESS OF OUR COUNTRY BECOME ITS PROPAGATORS AND ITS HERALDS
6880-216547-0058.flac,MAY I BE THE LAST OF YOUR PENSIONERS OF ALL THE WISHES THAT I CAN FRAME THAT GENTLEMEN IS THE MOST WORTHY OF YOU AND THE MOST HONORABLE FOR ME
6880-216547-0059.flac,TWO MONTHS AFTER THE RECEIPT OF THIS LETTER THE ACADEMY IN ITS DEBATE OF AUGUST TWENTY FOURTH REPLIED TO THE ADDRESS OF ITS PENSIONER BY A NOTE THE TEXT OF WHICH I GIVE BELOW
6880-216547-0060.flac,PUBLISHED LAST JUNE BY THE TITULARY OF THE SUARD PENSION ENTITLED WHAT IS PROPERTY AND DEDICATED BY THE AUTHOR TO THE ACADEMY HE IS OF THE OPINION THAT THE SOCIETY OWES IT TO JUSTICE
6880-216547-0061.flac,TO EXAMPLE AND TO ITS OWN DIGNITY TO PUBLICLY DISAVOW ALL RESPONSIBILITY FOR THE ANTI SOCIAL DOCTRINES CONTAINED IN THIS PUBLICATION IN CONSEQUENCE HE DEMANDS
6880-216547-0062.flac,IN THE MOST FORMAL MANNER THE WORK OF THE SUARD PENSIONER AS HAVING BEEN PUBLISHED WITHOUT ITS ASSENT AND AS ATTRIBUTING TO IT OPINIONS DIAMETRICALLY OPPOSED TO THE PRINCIPLES OF EACH OF ITS MEMBERS
6880-216547-0063.flac,IN CASE HE SHOULD PUBLISH A SECOND EDITION OF HIS BOOK TO OMIT THE DEDICATION
6880-216547-0064.flac,THAT THIS JUDGMENT OF THE ACADEMY BE PLACED UPON THE RECORDS THESE THREE PROPOSITIONS PUT TO VOTE ARE ADOPTED
6880-216547-0065.flac,AFTER THIS LUDICROUS DECREE WHICH ITS AUTHORS THOUGHT TO RENDER POWERFUL BY GIVING IT THE FORM OF A CONTRADICTION
6880-216547-0066.flac,I CAN ONLY BEG THE READER NOT TO MEASURE THE INTELLIGENCE OF MY COMPATRIOTS BY THAT OF OUR ACADEMY WHILE MY PATRONS IN THE SOCIAL AND POLITICAL SCIENCES WERE FULMINATING ANATHEMAS AGAINST MY BROCHURE
6880-216547-0067.flac,WHO DID NOT KNOW ME WHO MIGHT EVEN HAVE REGARDED HIMSELF AS PERSONALLY ATTACKED BY THE TOO SHARP JUDGMENT WHICH I HAD PASSED UPON THE ECONOMISTS A PUBLICIST AS LEARNED AS HE WAS MODEST LOVED BY THE PEOPLE WHOSE SORROWS HE FELT
6880-216547-0068.flac,HONORED BY THE POWER WHICH HE SOUGHT TO ENLIGHTEN WITHOUT FLATTERING OR DISGRACING IT
6880-216547-0069.flac,MEMBER OF THE INSTITUTE PROFESSOR OF POLITICAL ECONOMY DEFENDER OF PROPERTY TOOK UP MY DEFENCE BEFORE HIS ASSOCIATES AND BEFORE THE MINISTRY
6880-216547-0070.flac,AND SAVED ME FROM THE BLOWS OF A JUSTICE WHICH IS ALWAYS BLIND BECAUSE IT IS ALWAYS IGNORANT
6880-216547-0071.flac,A LETTER AS HONORABLE TO ITS AUTHOR AS IT IS FLATTERING TO HIM TO WHOM IT IS ADDRESSED PARIS MAY FIRST EIGHTEEN FORTY ONE MONSIEUR
6880-216547-0072.flac,I HASTEN TO THANK YOU FOR FORWARDING TO ME YOUR SECOND MEMOIR UPON PROPERTY I HAVE READ IT WITH ALL THE INTEREST THAT AN ACQUAINTANCE WITH THE FIRST WOULD NATURALLY INSPIRE I AM VERY GLAD THAT YOU HAVE MODIFIED SOMEWHAT
6880-216547-0073.flac,THE RUDENESS OF FORM WHICH GAVE TO A WORK OF SUCH GRAVITY THE MANNER AND APPEARANCE OF A PAMPHLET FOR YOU QUITE FRIGHTENED ME SIR AND YOUR TALENT WAS NEEDED TO REASSURE ME IN REGARD TO YOUR INTENTIONS
6880-216547-0074.flac,THIS PROPOSITION NOW COMING INTO NOTICE PROPERTY IS ROBBERY WAS OF A NATURE TO REPEL FROM YOUR BOOK EVEN THOSE SERIOUS MINDS WHO DO NOT JUDGE BY APPEARANCES HAD YOU PERSISTED IN MAINTAINING IT
6880-216547-0075.flac,IN ITS RUDE SIMPLICITY BUT IF YOU HAVE SOFTENED THE FORM YOU ARE NONE THE LESS FAITHFUL TO THE GROUND WORK OF YOUR DOCTRINES AND ALTHOUGH YOU HAVE DONE ME THE HONOR TO GIVE ME A SHARE IN THIS PERILOUS TEACHING
6880-216547-0076.flac,I CANNOT ACCEPT A PARTNERSHIP WHICH AS FAR AS TALENT GOES WOULD SURELY BE A CREDIT TO ME BUT WHICH WOULD COMPROMISE ME IN ALL OTHER RESPECTS I AGREE WITH YOU IN ONE THING ONLY
6880-216547-0077.flac,NAMELY THAT ALL KINDS OF PROPERTY GET TOO FREQUENTLY ABUSED IN THIS WORLD BUT I DO NOT REASON FROM THE ABUSE TO THE ABOLITION AN HEROIC REMEDY TOO MUCH LIKE DEATH
6880-216547-0078.flac,WHICH CURES ALL EVILS I WILL GO FARTHER I WILL CONFESS THAT OF ALL ABUSES THE MOST HATEFUL TO ME ARE THOSE OF PROPERTY BUT ONCE MORE
6880-216547-0079.flac,THERE IS A REMEDY FOR THIS EVIL WITHOUT VIOLATING IT ALL THE MORE WITHOUT DESTROYING IT IF THE PRESENT LAWS ALLOW ABUSE WE CAN RECONSTRUCT THEM OUR CIVIL CODE IS NOT THE KORAN
6880-216547-0080.flac,IT IS NOT WRONG TO EXAMINE IT CHANGE THEN THE LAWS WHICH GOVERN THE USE OF PROPERTY BUT BE SPARING OF ANATHEMAS FOR LOGICALLY WHERE IS THE HONEST MAN WHOSE HANDS ARE ENTIRELY CLEAN
6880-216547-0081.flac,DO YOU THINK THAT ONE CAN BE A ROBBER WITHOUT KNOWING IT WITHOUT WISHING IT WITHOUT SUSPECTING IT DO YOU NOT ADMIT THAT SOCIETY IN ITS PRESENT STATE LIKE EVERY MAN
6880-216547-0082.flac,HAS IN ITS CONSTITUTION ALL KINDS OF VIRTUES AND VICES INHERITED FROM OUR ANCESTORS IS PROPERTY THEN IN YOUR EYES A THING SO SIMPLE AND SO ABSTRACT THAT YOU CAN RE KNEAD AND EQUALIZE IT
6880-216547-0083.flac,IF I MAY SO SPEAK IN YOUR METAPHYSICAL MILL ONE WHO HAS SAID AS MANY EXCELLENT AND PRACTICAL THINGS AS OCCUR IN THESE TWO BEAUTIFUL AND PARADOXICAL IMPROVISATIONS OF YOURS CANNOT BE A PURE AND UNWAVERING UTOPIST
6880-216547-0084.flac,YOU ARE TOO WELL ACQUAINTED WITH THE ECONOMICAL AND ACADEMICAL PHRASEOLOGY TO PLAY WITH THE HARD WORDS OF REVOLUTIONS I BELIEVE THEN THAT YOU HAVE HANDLED PROPERTY
6880-216547-0085.flac,AS ROUSSEAU EIGHTY YEARS AGO HANDLED LETTERS WITH A MAGNIFICENT AND POETICAL DISPLAY OF WIT AND KNOWLEDGE SUCH AT LEAST IS MY OPINION
6880-216547-0086.flac,THAT IS WHAT I SAID TO THE INSTITUTE AT THE TIME WHEN I PRESENTED MY REPORT UPON YOUR BOOK I KNEW THAT THEY WISHED TO PROCEED AGAINST YOU IN THE COURTS YOU PERHAPS DO NOT KNOW BY HOW NARROW A CHANCE I SUCCEEDED IN PREVENTING THEM
6880-216547-0087.flac,WHAT CHAGRIN I SHOULD ALWAYS HAVE FELT IF THE KING'S COUNSEL THAT IS TO SAY THE INTELLECTUAL EXECUTIONER HAD FOLLOWED IN MY VERY TRACKS TO ATTACK YOUR BOOK AND ANNOY YOUR PERSON
6880-216547-0088.flac,I ACTUALLY PASSED TWO TERRIBLE NIGHTS AND I SUCCEEDED IN RESTRAINING THE SECULAR ARM ONLY BY SHOWING THAT YOUR BOOK WAS AN ACADEMICAL DISSERTATION AND NOT THE MANIFESTO OF AN INCENDIARY
6880-216547-0089.flac,YOUR STYLE IS TOO LOFTY EVER TO BE OF SERVICE TO THE MADMEN WHO IN DISCUSSING THE GRAVEST QUESTIONS OF OUR SOCIAL ORDER USE PAVING STONES AS THEIR WEAPONS
6880-216547-0090.flac,BUT SEE TO IT SIR THAT ERE LONG THEY DO NOT COME IN SPITE OF YOU TO SEEK FOR AMMUNITION IN THIS FORMIDABLE ARSENAL AND THAT YOUR VIGOROUS METAPHYSICS FALLS NOT INTO THE HANDS OF SOME SOPHIST OF THE MARKET PLACE
6880-216547-0091.flac,WHO MIGHT DISCUSS THE QUESTION IN THE PRESENCE OF A STARVING AUDIENCE WE SHOULD HAVE PILLAGE FOR CONCLUSION AND PERORATION
6880-216547-0092.flac,BUT THE MAJESTIC AND IMPOSING ORDER OF HUMAN SOCIETIES THAT I SOMETIMES FIND MYSELF EMBARRASSED IN ATTACKING CERTAIN ABUSES I LIKE TO REBUILD WITH ONE HAND WHEN I AM COMPELLED TO DESTROY WITH THE OTHER
6880-216547-0093.flac,IN PRUNING AN OLD TREE WE GUARD AGAINST DESTRUCTION OF THE BUDS AND FRUIT YOU KNOW THAT AS WELL AS ANY ONE YOU ARE A WISE AND LEARNED MAN YOU HAVE A THOUGHTFUL MIND
6880-216547-0094.flac,THE TERMS BY WHICH YOU CHARACTERIZE THE FANATICS OF OUR DAY ARE STRONG ENOUGH TO REASSURE THE MOST SUSPICIOUS IMAGINATIONS AS TO YOUR INTENTIONS BUT YOU CONCLUDE
6880-216547-0095.flac,IN FAVOR OF THE ABOLITION OF PROPERTY YOU WISH TO ABOLISH THE MOST POWERFUL MOTOR OF THE HUMAN MIND YOU ATTACK THE PATERNAL SENTIMENT IN ITS SWEETEST ILLUSIONS WITH ONE WORD YOU ARREST THE FORMATION OF CAPITAL
6880-216547-0096.flac,AND WE BUILD HENCEFORTH UPON THE SAND INSTEAD OF ON A ROCK THAT I CANNOT AGREE TO AND FOR THAT REASON I HAVE CRITICISED YOUR BOOK SO FULL OF BEAUTIFUL PAGES
6880-216547-0097.flac,SO BRILLIANT WITH KNOWLEDGE AND FERVOR I WISH SIR THAT MY IMPAIRED HEALTH WOULD PERMIT ME TO EXAMINE WITH YOU PAGE BY PAGE THE MEMOIR WHICH YOU HAVE DONE ME THE HONOR TO ADDRESS TO ME PUBLICLY AND PERSONALLY
6880-216547-0098.flac,I DESIRE ALSO THE MERIT OF PRUDENCE YOU KNOW HOW DEEP SEATED IS THE DISEASE UNDER WHICH THE WORKING PEOPLE ARE SUFFERING I KNOW HOW MANY NOBLE HEARTS BEAT UNDER THOSE RUDE GARMENTS
6880-216547-0099.flac,WHO RISE EARLY IN THE MORNING TO LABOR TO PAY THEIR TAXES AND TO MAKE OUR COUNTRY STRONG I TRY TO SERVE AND ENLIGHTEN THEM WHEREAS SOME ENDEAVOR TO MISLEAD THEM
6880-216547-0100.flac,YOU HAVE NOT WRITTEN DIRECTLY FOR THEM YOU HAVE ISSUED TWO MAGNIFICENT MANIFESTOES THE SECOND MORE GUARDED THAN THE FIRST ISSUE A THIRD MORE GUARDED THAN THE SECOND
6880-216547-0101.flac,AND YOU WILL TAKE HIGH RANK IN SCIENCE WHOSE FIRST PRECEPT IS CALMNESS AND IMPARTIALITY FAREWELL SIR NO MAN'S ESTEEM FOR ANOTHER CAN EXCEED MINE FOR YOU BLANQUI
6880-216547-0102.flac,I SHOULD CERTAINLY TAKE SOME EXCEPTIONS TO THIS NOBLE AND ELOQUENT LETTER BUT I CONFESS THAT I AM MORE INCLINED TO REALIZE THE PREDICTION WITH WHICH IT TERMINATES THAN TO AUGMENT NEEDLESSLY THE NUMBER OF MY ANTAGONISTS
6880-216547-0103.flac,SO MUCH CONTROVERSY FATIGUES AND WEARIES ME THE INTELLIGENCE EXPENDED IN THE WARFARE OF WORDS IS LIKE THAT EMPLOYED IN BATTLE IT IS INTELLIGENCE WASTED
6880-216547-0104.flac,I CALL PROPERTY
6880-216547-0105.flac,TO EACH OF US PROPERTY SEEMS A POLYGON WHOSE ANGLES NEED KNOCKING OFF BUT THE OPERATION PERFORMED
6880-216547-0106.flac,AN HYPOTHESIS ADMITTED IN MATHEMATICS ALTHOUGH NOT PROVEN WHILE I CONSIDER THAT THIS FIGURE WILL BE A CIRCLE HONEST PEOPLE CAN AT LEAST UNDERSTAND ONE ANOTHER
6880-216547-0107.flac,FOR THE REST I ALLOW THAT IN THE PRESENT STATE OF THE QUESTION THE MIND MAY LEGITIMATELY HESITATE BEFORE DECIDING IN FAVOR OF THE ABOLITION OF PROPERTY
